awards,name,station,genre,pr,dinner_budget,lunch_budget,rating,holiday,url,reserve_status,reserve_method,transportation,opening_time,extra_holiday_info,payment_methods,geo_coordinates,telephone,address,num_review
,トムクリオーザ,北新地駅 201m , イタリアン,,"￥20,000～￥29,999","￥20,000～￥29,999",4.12,-,https://tabelog.com/osaka/A2701/A270101/27135015/,予約可,ご予約は予約サイトOMAKASEでのみ承っております。お電話では承っておりません。よろしくお願い申し上げます。・ご予約当日のキャンセル（もしくは減少した人数）　コース料金の100％・ご予約の前営業日でのキャンセル（もしくは減少した人数）　コース料金の50%キャンセル料といたしまして頂戴いたします。上記の内容のご理解の程、 何卒よろしくお願い致します。,JR北新地駅 11-23口　徒歩7分　地下御堂筋線　淀屋橋駅　7番出口　徒歩10分JR大阪駅徒歩15分京阪　大江橋 1番口　徒歩5分 北新地駅から201m,,,カード可 （VISA、Master、JCB、AMEX、Diners） 電子マネー不可 QRコード決済不可,"34.697083737981714,135.4979912774357",050-3188-6885,大阪府大阪市北区曽根崎新地1-2-7 櫻ビル 3F,164
食べログ イタリアン WEST 百名店 2023 選出店,グシテ,天満橋駅 452m , イタリアン,,"￥20,000～￥29,999","￥20,000～￥29,999",4.12,木曜日,https://tabelog.com/osaka/A2701/A270104/27093817/,予約可,基本的にお任せのコース料理、好みは聞いてもらえる,京阪電車　天満橋歩いて5分 天満橋駅から452m,18:00 - 00:00,■ 定休日月１回(不定休),カード可 （JCB、AMEX、Diners） 電子マネー不可 QRコード決済不可,"34.69338183799018,135.51722377738483",06-6809-7376,大阪府大阪市北区天満2-7-1 末澤ビル 1F,144
,IAKU ,北新地駅 105m , フレンチ、イタリアン、イノベーティブ,ライブ感溢れる空間で、厳選食材から生まれる革新的なコース料理を五感で愉しむ,"￥20,000～￥29,999","￥20,000～￥29,999",3.94,,https://tabelog.com/osaka/A2701/A270101/27130596/,完全予約制,キャンセル料について希少な食材を取り寄せて調理をしておりますので、3日前からのキャンセルの場合、キャンセル料を頂戴しております。・予約日3日前(0:00)〜　50%・予約日1日前(0:00)〜 100%ご了承の上ご予約下さいませ。,JR北新地駅から徒歩3分　※11-21出口JR大阪駅から徒歩10分地下鉄西梅田駅から徒歩3分 北新地駅から105m,18:00 - 22:00,■ 営業時間当店は、『一斉スタート』での営業とさせていただきます。開始10分前より入店頂けます。到着が遅れる場合は、ご連絡お願いします。■ 定休日月によっては日曜日営業の日有り,カード可 （VISA、Master、JCB、AMEX） 電子マネー不可 QRコード決済不可,"34.69747879205874,135.4967364295947",06-6131-8819,大阪府大阪市北区曽根崎新地1-3-30 北新地KOHDAビル6階606B号室,102
The Tabelog Award 2024 Bronze 受賞店,クイントカント,渡辺橋駅 211m , イタリアン,【イタリアンの進化系】モダン＆クラシックな空間で食す多彩な高級イタリアン,"￥15,000～￥19,999","￥15,000～￥19,999",3.89,,https://tabelog.com/osaka/A2701/A270108/27073813/,予約可,※アレルギーやお苦手な食材がございましたら事前に当店までお知らせ下さい。※16歳未満の方のご来店はご遠慮いただいております。身分証のご提示をお願いする場合もございます。ご協力をお願い致します。※当店はコース料理のみ。アラカルトはございません。※ワインや食材のお持ち込みはお断りさせて頂いております。,京阪 中之島線 「渡辺橋」より徒歩5分四ツ橋線「肥後橋」北改札口より徒歩10分ダイビル館内からは入店はできません。当店の入口は外からのみとなっております(ダイビル本館の西側) 渡辺橋駅から211m,12:00 - 15:00L.O. 料理13:00,■ 営業時間《ランチ》 13:00最終入店《ディナー》 20:00最終入店■ 定休日無休　※臨時休業あり,カード可 （VISA、Master、JCB、AMEX、Diners） 電子マネー不可 QRコード決済不可,"34.69326963798239,135.49249087740102",06-6479-1811,大阪府大阪市北区中之島3-6-32 ダイビル本館 1F,908
,十皿,大江橋駅 273m , イノベーティブ、イタリアン、海鮮,,"￥10,000～￥14,999","￥10,000～￥14,999",3.88,日曜日、祝日,https://tabelog.com/osaka/A2701/A270101/27106878/,完全予約制,※※ご予約の際は、十皿ホームページのネット予約、またはお電話で承ります※※,JR東西線北新地より徒歩10分大阪メトロ淀屋橋駅より徒歩約8分東梅田駅より徒歩約15分 大江橋駅から273m,12:00 - 15:00,■ 営業時間●当店は、『一斉スタート』での営業とさせていただきます。※開始15分前より入店頂けます。※到着が遅れる場合は、必ずご連絡お願いします。お客様には、ご不便をおかけするかと存じますが、精一杯努めてまいります。,カード可 電子マネー不可 QRコード決済可 （PayPay）,"34.695957137983754,135.50213617742142",06-7709-1283,大阪府大阪市北区西天満2-7-26 徳矢ビル 1F,235
食べログ ステーキ・鉄板焼き WEST 百名店 2024 選出店,北新地 福多亭 The Ukai,北新地駅 244m , ステーキ、イタリアン、ワインバー,“世界ベストステーキ11””ミシュラン”等で評価された”窯焼きステーキ”と本格的イタリアン,"￥20,000～￥29,999","￥20,000～￥29,999",3.79,,https://tabelog.com/osaka/A2701/A270101/27066944/,完全予約制,※当日キャンセルは料理代金の100％を頂戴致します。※代理予約等はお断りさせて頂きます。(We don't accept proxy reservations.)※香水、オーデコロン等強い香りをまとってのご来店はご遠慮いただけますようお願い申し上げます。,北新地駅　徒歩約1分 北新地駅から244m,12:00 - 14:30L.O. 14:00,電話予約の受付は14：00～16：00とさせて頂きます。,カード可 （VISA、Master、JCB、AMEX、Diners） 電子マネー不可 QRコード決済不可,"34.69800453798149,135.49909937744422",06-6341-8588,大阪府大阪市北区曽根崎新地1丁目11-19 北新地スタービル Ｂ１,359
食べログ イタリアン WEST 百名店 2023 選出店,ポンテ ベッキオ,北浜駅 42m , イタリアン,,"￥15,000～￥19,999","￥15,000～￥19,999",3.77,-,https://tabelog.com/osaka/A2701/A270102/27000522/,予約可,・勝手ながら原則として中学生未満の方はご遠慮いただいております。・当日のキャンセル及び人数が減られた場合、お料理代金をキャンセル料として申し受けます。,大阪メトロ堺筋線北浜駅・京阪電車北浜駅直結。 北浜駅から42m,11:30 - 14:00,■ 定休日水曜日・木曜日　(年末年始12月31日～1月3日),カード可 （VISA、Master、JCB、AMEX、Diners） 電子マネー不可 QRコード決済不可,"34.69144203798826,135.5073061773722",06-6229-7770,大阪府大阪市中央区北浜1-8-16 大阪証券取引所ビル　１Ｆ,510
,WINE食堂 緒乃,北新地駅 164m , イタリアン、ワインバー,シェフが手間を惜しまず仕上げた渾身のお料理とソムリエ厳選のワインが気軽に愉しめるワイン食堂,"￥15,000～￥19,999","￥15,000～￥19,999",3.76,,https://tabelog.com/osaka/A2701/A270101/27124092/,予約可,5～6名の個室のご予約も承ります。お電話でご相談ください。,北新地駅西梅田駅 北新地駅から164m,18:00 - 00:00L.O. 料理23:00 ドリンク23:30,※臨時休業する場合がございます。夏季休業・年末年始休業致します。,カード可 （VISA、Master、JCB、AMEX、Diners） 電子マネー不可 QRコード決済不可,"34.69738213798145,135.49777727743884",06-6342-1118,大阪府大阪市北区曾根崎新地1-2-22 北リンデンビル 4F,97
,ラ ピニャータ,堺筋本町駅 371m , イタリアン、ステーキ、肉料理,【堺筋本町駅徒歩5分】南イタリア料理とイタリアワインのお店,"￥8,000～￥9,999","￥8,000～￥9,999",3.73,,https://tabelog.com/osaka/A2701/A270106/27072091/,予約可,当日の時間変更は必ずお電話でお問い合わせ下さい。尚、当時のキャンセルはコース料金の100%頂きます。中学生以下のお子様でネット予約でご予約をされる場合はネット予約とお電話でもお知らせ下さい。※店内が大変込み合うため宜しくお願い致します。※チャージ料　席のみ予約ディナーお一人様660円。※お一人様ワンドリンク制。※テーブル席又はカウンター席直前に変更の可能も御座います。,地下鉄御堂筋線本町駅12番出口から徒歩７分地下鉄堺筋線堺筋本町駅11番出口から徒歩５分［2号店　マンジャ エ ベーヴィ!!  地下鉄御堂筋線本町駅７番出口より徒歩約3分3号店　イタリアンバールラピニャータ　梅田イノゲート大阪内バルチカ03エキウエ5階] 堺筋本町駅から371m,17:00 - 23:00L.O. 23:00,■ 営業時間17:00~23:00(L.o)■ 定休日日曜日月2回不定休9月6日(金)営業再開します！2号店のマンジャエベーヴィ!!はランチ、ディナー共に営業致します。3号店が7月に梅田バルチカ03にイタリアンバールラピニャータがOpenしました！,カード可 （VISA、Master、JCB、AMEX、Diners） 電子マネー不可 QRコード決済可 （PayPay）,"34.679372737995,135.5043819772523",06-6226-8570,大阪府大阪市中央区南久宝寺町2-5-3 ときわビル 1F,418
食べログ イタリアン WEST 百名店 2023 選出店,Pluie dete,北新地駅 33m , フレンチ、イタリアン,《北新地駅2分》～Pluie d'été劇場開幕～ （フレンチレストラン）,"￥5,000～￥5,999","￥5,000～￥5,999",3.72,,https://tabelog.com/osaka/A2701/A270101/27116251/,予約可,"当日キャンセルの場合はコース料金100％、前日キャンセルはコース料金50％のキャンセル料を頂戴致しております。当店無断キャンセル及び、他店無断キャンセルをされているお客様は、ご予約を取り消しさせていただくことがございます。仮予約・二重予約はキャンセル処理させていただきます。X,masと年末の予約キャンセルは5日前から50％キャンセル料　当日キャンセル料100％となります。",大阪メトロ四ツ橋線「西梅田」より徒歩1分JR東西線「北新地」より徒歩2分JR「大阪」駅より徒歩6分 北新地駅から33m,,,カード可 （VISA、Master、JCB、AMEX、Diners） 電子マネー不可 QRコード決済不可,"34.69866153798018,135.4963065774528",06-6342-5517,大阪府大阪市北区梅田1-3-1-100 大阪駅前第一ビル 1F,741
食べログ ピザ 百名店 2023 選出店,ダルブリガンテ,新福島駅 247m , イタリアン(ピザ)、イタリアン,,"￥4,000～￥4,999","￥4,000～￥4,999",3.72,火曜日,https://tabelog.com/osaka/A2701/A270108/27004565/,予約可,ランチ営業でのご予約は平日1時、週末12時までのご来店のみお承りしております。,ＪＲ新福島3番出口より徒歩５分JR福島駅より徒歩１０分 新福島駅から247m,,,カード可 （JCB、AMEX、Diners） 電子マネー不可 QRコード決済可,"34.69300533797995,135.48430997740408",06-6451-4605,大阪府大阪市福島区福島3-6-14 ,658
食べログ イタリアン WEST 百名店 2023 選出店,マカウダ,谷町四丁目駅 272m , イタリアン,,"￥5,000～￥5,999","￥5,000～￥5,999",3.72,火曜日,https://tabelog.com/osaka/A2701/A270104/27112899/,予約可,"土日祝日のランチ予約は、ランチコース（￥3,000～）のみ受付（その他応相談）Instagramにてオンライン予約受付中",谷町四丁目駅から272m,11:30 - 14:00,■ 定休日月2回不定休,カード可 （VISA、Master、JCB、AMEX、Diners） 電子マネー不可 QRコード決済可 （PayPay）,"34.68244103799621,135.51430597727634",06-4792-8262,大阪府大阪市中央区常盤町2-1-3 ハイネス常磐 1F,325
食べログ イタリアン WEST 百名店 2023 選出店,Il Povero Diavolo,今宮戎駅 223m , イタリアン、ワインバー、海鮮,,"￥15,000～￥19,999","￥15,000～￥19,999",3.72,-,https://tabelog.com/osaka/A2701/A270206/27076550/,予約可,アレルギーやお苦手な食材がございましたら、ご予約の際に必ずお知らせ下さい。おまかせコース1種のみとなっておりますので、当日の食材変更はお受けできないことがございますのでご了承下さい。,御堂筋線　四つ橋線　「大国町駅」から　徒歩５分南海電鉄　「難波駅」から　徒歩１５分南海電鉄　「今宮戎駅」から　徒歩５分 今宮戎駅から223m,,,カード可 電子マネー不可 QRコード決済不可,"34.65689093800813,135.50077707702775",06-4395-5150,大阪府大阪市浪速区敷津東2-2-1 317号,108
食べログ イタリアン WEST 百名店 2023 選出店,アルバロンガ,心斎橋駅 198m , イタリアン、イタリアン(パスタ)、ダイニングバー,【心斎橋駅2分】旬食材を生かしたイタリア料理と多彩なワインを堪能。上質な大人の日常使いに。,"￥6,000～￥7,999","￥6,000～￥7,999",3.7,,https://tabelog.com/osaka/A2701/A270201/27009401/,予約可,,地下鉄御堂筋線心斎橋駅徒歩2分 心斎橋駅から198m,,,カード可 （VISA、Master、JCB、AMEX、Diners） 電子マネー可 （交通系電子マネー（Suicaなど）、楽天Edy、nanaco、WAON、iD、QUICPay） QRコード決済可 （PayPay、d払い）,"34.674633937997406,135.5024793772058",06-6258-0118,大阪府大阪市中央区東心斎橋1-19-15 Ｕｎａｇｉｄａｎｉ　Ｂｌｏｃｋ　２Ｆ,594
食べログ ピザ 百名店 2023 選出店,ピッツェリア・スクニッツォ・ダ・シゲオ,天神橋筋六丁目駅 617m , イタリアン(ピザ)、イタリアン,,"￥4,000～￥4,999","￥4,000～￥4,999",3.7,月曜日,https://tabelog.com/osaka/A2701/A270103/27053555/,予約可,,･地下鉄中崎町駅 2番出口より北へ徒歩10分中津駅より東へ徒歩15分天神橋筋六丁目駅 6番出口より西へ徒歩10分・大阪駅より大阪市バス34系統本庄西二丁目バス停下車　徒歩4分 天神橋筋六丁目駅から617m,,,カード可 電子マネー不可 QRコード決済可 （PayPay）,"34.713246337973835,135.50547267759367",090-1190-1676,大阪府大阪市北区本庄西2丁目4-7 ,493
,レオーネ,大江橋駅 232m , イノベーティブ、イタリアン、ヨーロッパ料理,鰤宝入荷！グラングリーン大阪移転まであと3ヶ月！,"￥10,000～￥14,999","￥10,000～￥14,999",3.7,,https://tabelog.com/osaka/A2701/A270101/27011193/,予約可,下記の場合、お電話にてお問い合わせ下さい。◆当日のご予約◆2名様でのテーブル予約◆4名様以上でのご予約,JR北新地駅 11-5・11-21番出口 徒歩3分 地下鉄四ッ橋線西梅田駅 C-60番出口 徒歩3分 大江橋駅から232m,17:30 - 23:00,■ 営業時間コースの最終ご案内は21時となります。,カード可 （VISA、Master、JCB、AMEX、Diners） 電子マネー可 QRコード決済可 （PayPay、楽天ペイ）,"34.696314837982555,135.4991345774271",06-6348-1151,大阪府大阪市北区堂島1-2-7 パーマリィ・イン堂島 3F,198
,ア・カント,谷町四丁目駅 379m , イタリアン,,"￥10,000～￥14,999","￥10,000～￥14,999",3.7,水曜日,https://tabelog.com/osaka/A2701/A270104/27104963/,予約可,,谷町四丁目駅より徒歩8分 谷町四丁目駅から379m,,,カード可 （VISA、Master、JCB、AMEX、Diners） 電子マネー可,"34.67894613799888,135.51571637724004",06-7175-6383,大阪府大阪市中央区内久宝寺町3-1-10 ,46
,ラ・バルカッチャ,中津（大阪メトロ）駅 226m , イタリアン、イタリアン(ピザ),当初定休日でした１２月２日月曜日、急遽営業する事になりました！！ご予約お待ちしております！,"￥5,000～￥5,999","￥5,000～￥5,999",3.69,火曜日,https://tabelog.com/osaka/A2701/A270101/27054558/,予約可,下記時間にお電話頂きます様お願い致します。(混雑している場合、電話対応が難しい為です。ご来店されてるお客様を優先させて頂きたいと思っております。)10:00〜12:0014:00〜17:3021:30〜23:00※当日のご予約は上記時間帯以外、営業中でも承っております。詳細は当店Instagramページの「ご予約について」「お席・お料理について」をご確認下さいませ。,地下鉄御堂筋線中津駅徒歩5分阪急梅田駅徒歩10分 中津駅（大阪メトロ）から226m,18:00 - 22:30L.O. 料理21:30 ドリンク22:30,※第１・３・５の奇数週の水曜日はお休み致します。※日曜日の翌日が祝日の場合日曜日→土曜日と同じ営業時間翌日の祝日→通し営業時間となります。,カード可 （VISA、Master、JCB、AMEX） 電子マネー不可 QRコード決済不可,"34.71114249156382,135.49942973366038",06-6373-8181,大阪府大阪市北区豊崎3-5-17 1階,387
,MAKIBI,なにわ橋駅 339m , イタリアン、イタリアン(ピザ)、イタリアン(パスタ),【北浜駅徒歩6分】旬食材と厳選ワインの創作イタリアン！記念日や接待に◎コース6500円～,"￥6,000～￥7,999","￥6,000～￥7,999",3.69,,https://tabelog.com/osaka/A2701/A270102/27108201/,予約可,予約システムを変更したため、ネット予約はテーブルチェックというサイトからだと比較的スムーズです。マキビ　テーブルチェックで検索するとすぐに表示されます。食べログのネット予約カレンダーが空いていない場合でもテーブルチェックなら空いている場合がございます。ご確認の程宜しくお願い致します。,北浜駅（地下鉄・京阪）26番出口より徒歩６分南森町駅（地下鉄）2番出口より徒歩6分大阪天満宮駅（JR東西線)より徒歩10分なにわ橋駅（京阪）より徒歩5分 なにわ橋駅から339m,17:00 - 23:30L.O. 料理22:30 ドリンク23:00,■ 営業時間最終入店22：00■ 定休日無休営業（例外的にお休みを頂戴することがございます）,カード可 （VISA、Master、JCB、AMEX、Diners） 電子マネー不可 QRコード決済可 （PayPay）,"34.69429333798705,135.50918007739963",06-6585-0766,大阪府大阪市北区西天満3-1-27 メビウス西天満ビル 1F,238
,ペッシェ・ロッソ,長堀橋駅 116m , イタリアン、海鮮,洗練された上質な空間で、四季折々の恵みを散りばめたイタリアンを豊富なワインと共に愉しむ,"￥10,000～￥14,999","￥10,000～￥14,999",3.69,,https://tabelog.com/osaka/A2701/A270201/27049992/,予約可,予約内容・キャンセル日によってはキャンセル料が発生する場合があります,堺筋線　長堀鶴見緑地線　長堀橋駅　７番出口　西に徒歩２分堺筋線　長堀鶴見緑地線　長堀橋駅　５番出口　南西に徒歩３分御堂筋線　心斎橋駅　５番出口　東に徒歩５分 長堀橋駅から116m,17:30 - 01:00L.O. 00:30,■ 定休日月曜（祝祭日の場合はその翌日）,カード可 （VISA、Master、JCB、AMEX、Diners） 電子マネー不可 QRコード決済可 （PayPay）,"34.67370713799898,135.5055956771942",06-6241-0030,大阪府大阪市中央区東心斎橋1-3-18 ,189
食べログ イタリアン WEST 百名店 2023 選出店,イル・チェントリーノ,松屋町駅 337m , イタリアン、ワインバー、イノベーティブ,「ミシュランガイド京都・大阪」にて4年連続、一つ星を獲得！,"￥10,000～￥14,999","￥10,000～￥14,999",3.69,,https://tabelog.com/osaka/A2701/A270204/27105629/,予約可,,地下鉄谷町線「谷町６丁目」より徒歩５分、地下鉄長堀鶴見緑地線「松屋町」より徒歩５分 松屋町駅から337m,12:00 - 14:30L.O. 12:30,■ 定休日不定休あり,カード可 （VISA、Master、AMEX） 電子マネー不可 QRコード決済不可,"34.67292573800221,135.51415897718033",06-6762-5901,大阪府大阪市中央区瓦屋町1-2-2 ,149
,ラ・ルッチョラ,福島駅 190m , イタリアン,,"￥10,000～￥14,999","￥10,000～￥14,999",3.69,火曜日,https://tabelog.com/osaka/A2701/A270108/27113735/,予約可,,福島駅から190m,,,カード可 （VISA、Master、JCB、AMEX、Diners） 電子マネー不可 QRコード決済不可,"34.69657513797905,135.48860007743713",06-6458-0199,大阪府大阪市福島区福島5-7-3 ,77
,ラチェルバ,大江橋駅 156m , イノベーティブ、イタリアン,,"￥15,000～￥19,999","￥15,000～￥19,999",3.69,日曜日,https://tabelog.com/osaka/A2701/A270101/27086479/,完全予約制,予約は2名様から受付。■ アレルギーやお苦手な食材がございましたら、事前に当店にまでお知らせください。(御来店されてからになりますと、変更が出来兼ねる場合がございます。)■ご予約日時の２日以降から24時間前までのキャンセルにつきましては、50％のお料理代金を頂戴いたします。■ご予約日時の24時間以内のキャンセルにつきましては、100％のお料理代金を頂戴いたします。,(電車でお越しの場合)京阪中之島線「大江橋駅」1番出口より北へ徒歩6分地下鉄「淀屋橋駅」7番出口より北へ徒歩10分JR東西線「北新地駅 」11-21番、11-23番出口より南へ徒歩5分 大江橋駅から156m,17:00 - 22:30,■ 営業時間20：00最終御入店,カード可 （VISA、Master、JCB、AMEX、Diners） 電子マネー不可 QRコード決済不可,"34.69566633798308,135.49943017742035",06-6136-8089,大阪府大阪市北区堂島浜1-2-1 新ダイビル 2F,70
,アネロ,天神橋筋六丁目駅 253m , イタリアン、バル,,"￥2,000～￥2,999","￥2,000～￥2,999",3.68,日曜日,https://tabelog.com/osaka/A2701/A270103/27079346/,予約可,4名様以上のご予約のみ、カウンターの予約はお受けしておりません。ご了承願います。 2016年1月より。,天神橋筋六丁目駅 1番出口より徒歩3分天満駅より徒歩5分 天神橋筋六丁目駅から253m,17:30 - 00:00L.O. 23:30,■ 営業時間17:30～24:00（大体です）,カード不可 電子マネー不可,"34.70845333797927,135.51298897754",不明の為情報お待ちしております,大阪府大阪市北区池田町14-12 ,300
食べログ お好み焼き 百名店 2024 選出店,たぴおか食堂,寺田町駅 454m , お好み焼き、イタリアン,,"￥1,000～￥1,999","￥1,000～￥1,999",3.68,火曜日,https://tabelog.com/osaka/A2701/A270203/27096277/,予約可,予約優先（掘りごたつ×4卓、2名掛テーブル×2卓）土日祝日の昼のみ予約制限あり※11:30〜6組のみ（お料理の提供に時間を頂きます）※以降、空席が出次第、並ばれた順に入店（2024.10.13.更新）予約が埋まっていない場合でも、並び列がある場合は、ご予約の受付を中止します。,大阪環状線　寺田町駅から徒歩6分 寺田町駅から454m,11:30 - 14:30L.O. 14:00,■ 営業時間売り切れなどで早まる場合があります。■ 定休日火曜日◼︎その他休業日２０２４年１１月９日（土）〜１２日（火）１２月９日（月）１２月３０日（月）〜２０２５年１月７日（火）以降、随時更新。,カード不可 電子マネー不可 QRコード決済可 （PayPay）,"34.65196993801838,135.52315317696238",06-6775-2331,大阪府大阪市天王寺区国分町9-14 ,191
食べログ ピザ 百名店 2023 選出店,ラ ピッツァ ナポレターナ レガロ,新福島駅 284m , イタリアン(ピザ)、イタリアン,,"￥2,000～￥2,999","￥2,000～￥2,999",3.67,火曜日,https://tabelog.com/osaka/A2701/A270108/27084799/,予約不可,,阪神本線福島駅から徒歩3分 新福島駅から284m,,,カード可 （AMEX） 電子マネー不可 QRコード決済不可,"34.69522853797993,135.48868557742344",06-4796-2215,大阪府大阪市福島区福島1-5-2 堀野ビル 1F,475
食べログ イタリアン WEST 百名店 2023 選出店,島之内フジマル醸造所,松屋町駅 150m , イタリアン、ワインバー、ダイニングバー,【松屋町駅徒歩数分！】都市型ワイナリー併設レストラン,"￥6,000～￥7,999","￥6,000～￥7,999",3.67,,https://tabelog.com/osaka/A2701/A270204/27071950/,予約可,※お昼の利用の場合、ご予約の状況により滞在時間を17時までとさせて頂く場合がございます。※21:30(フードL.O)23:00閉店,鶴見緑地線　松屋町駅徒歩１分堺筋線　　　長堀橋駅徒歩５分御堂筋線　　心斎橋駅徒歩１５分（クリスタ長堀経由） 松屋町駅から150m,,,カード可 （VISA、Master、JCB、AMEX、Diners） 電子マネー不可 QRコード決済不可,"34.67461533800002,135.51064307719986",06-4704-6666,大阪府大阪市中央区島之内1-1-14 三和ビル 1F,424
