awards,name,station,genre,pr,dinner_budget,lunch_budget,rating,holiday,url,reserve_status,reserve_method,transportation,opening_time,extra_holiday_info,payment_methods,geo_coordinates,telephone,address,num_review
,燻製バル モトカラ,大阪難波駅 365m , バル、居酒屋、イタリアン,料理・調味料・ドリンクまでスモーキーに味わえる燻製バル◎換気の良いテラス席有！,"￥3,000～￥3,999","￥3,000～￥3,999",3.3,,https://tabelog.com/osaka/A2701/A270202/27094924/,予約可,コースご予約以外（お通し）税込み300円頂戴いたします。,大阪難波駅より徒歩10分入り口は道頓堀の川側にあります。 大阪難波駅から365m,16:00 - 23:00,■定休日不定休,カード可 （VISA、Master、JCB、AMEX、Diners） 電子マネー可 （交通系電子マネー（Suicaなど）、楽天Edy、nanaco、WAON、iD、QUICPay） QRコード決済可,"34.66930362878046,135.50234913976374",06-6213-5578,大阪府大阪市中央区宗右衛門町7-11 B1F,108
,ゴブプラス,天満駅 238m , ビストロ、スペイン料理、イタリアン,天満駅徒歩2分！ホテルオークラ出身シェフ監修ピザ＆パスタやスペイン人シェフの本格料理を堪能,"￥2,000～￥2,999","￥2,000～￥2,999",3.3,,https://tabelog.com/osaka/A2701/A270103/27074684/,予約可,,大阪環状線「天満」駅北側出口より徒歩2分「ぷらら天満」の北側です。 天満駅から238m,14:00 - 00:00L.O. 料理23:00 ドリンク23:30,■ 定休日不定休,カード可 （VISA、Master、JCB、AMEX、Diners） 電子マネー不可,"34.707122137979994,135.51259177752686",06-6314-6607,大阪府大阪市北区池田町6-17 ,100
,ペルコラ 天王寺MIO店,天王寺駅 44m , イタリアン、イタリアン(パスタ),天王寺MIO10階◆行列のできるパスタ専門店◎リーズナブルに本格イタリアンをどうぞ☆,"￥1,000～￥1,999","￥1,000～￥1,999",3.3,,https://tabelog.com/osaka/A2701/A270203/27047765/,,,天王寺駅から44m,11:00 - 22:00,■ 定休日天王寺MIOに準ずる,,"34.64668223801903,135.51463017691495",06-6770-1158,大阪府大阪市天王寺区悲田院町10-39 天王寺MIO 本館 10Ｆ,88
,路地裏のサルヴァ通る,難波（南海）駅 270m , 居酒屋、イタリアン、ステーキ,難波駅スグ！創作料理＆ドリンク230種！食ト酒との新たな出会い。個室有り♪価格は税込み表記,"￥3,000～￥3,999","￥3,000～￥3,999",3.3,,https://tabelog.com/osaka/A2701/A270202/27119780/,予約可,※席のみ御予約の場合も、事前連絡なく御入店後に人数が減られた場合は、キャンセル料としてお一人様あたり1500円頂戴致しておりますので、予めご了承下さいませ。※お客様から御連絡がないまま御予約時間を過ぎ、お電話が繋がらない場合はキャンセル扱いとさせて頂く事もございますので、予めご了承下さいませ。,〇南海難波北出口から徒歩３分〇地下鉄なんば駅E5番出口徒歩１分〇近鉄難波駅＆阪神難波駅から徒歩５分〇高島屋＆マルイ＆EDION＆ビックカメラから徒歩１分〇なんばパークス＆道頓堀から徒歩５分〇地下鉄日本橋駅B１７番出口から徒歩１分 難波駅（南海）から270m,16:00 - 23:30,■ 定休日〇火曜日が祝日の場合は月曜日営業致します！※火曜日がお休み,カード可 （VISA、Master、JCB、AMEX、Diners） 電子マネー可 （交通系電子マネー（Suicaなど）、iD、QUICPay） QRコード決済可 （PayPay、d払い、楽天ペイ、au PAY）,"34.665989738002835,135.5022695771186",06-6647-2200,大阪府大阪市中央区難波3-1-27 Mido難波ビル,84
,タントタント 大丸心斎橋店,心斎橋駅 154m , イタリアン、イタリアン(パスタ)、イタリアン(ピザ),お洒落で開放感あふれる空間で、本場イタリアの味をご堪能,"￥3,000～￥3,999","￥3,000～￥3,999",3.3,,https://tabelog.com/osaka/A2701/A270201/27113175/,予約可,,地下鉄御堂筋線 心斎橋駅直結 心斎橋駅から154m,11:00 - 15:30L.O. 15:00,■ 定休日百貨店に準ずる,カード可 電子マネー不可 QRコード決済可,"34.67303463799794,135.50101067719066",06-6258-6618,大阪府大阪市中央区心斎橋筋1-7-1 大丸心斎橋店 本館 10F,81
,ティ・コ・ラッテ・ネヤガワ,寝屋川市駅 808m , ケーキ、カフェ、イタリアン,,-,-,3.3,-,https://tabelog.com/osaka/A2707/A270702/27042795/,予約可,,京阪寝屋川市駅　徒歩約10分京阪バス寝屋川市役所前　すぐ 寝屋川市駅から808m,10:00 - 20:00,■ 営業時間ランチタイム 11:30～14:30■ 定休日不定休(公式サイトに営業日カレンダーあり),カード可 電子マネー可 QRコード決済可,"34.76712433797881,135.62854087805167",072-823-7766,大阪府寝屋川市豊野町15-6 ,77
,ザ・ループ ホテルアゴーラ大阪守口,守口市駅 82m , イタリアン、ビュッフェ、ステーキ,,"￥5,000～￥5,999","￥5,000～￥5,999",3.3,,https://tabelog.com/osaka/A2707/A270701/27067415/,予約可,お席のご指定は出来かねます。ご予約人数 及び 当日の状況に合わせてお席をご用意させて頂いております。予めご了承ください。,京阪電車「守口市駅」すぐ東口よりプロムナードを通ってホテルの2Fへ直結 守口市駅から82m,,,カード可 （VISA、Master、JCB、AMEX、Diners） 電子マネー不可 QRコード決済可 （PayPay）,"34.735027486271655,135.5658722825715",06-6994-1185,大阪府守口市河原町10-5 ホテル アゴーラ 大阪守口 1F,64
,肉バルで黒毛和牛食べ放題トリコミート 京橋店,京橋駅 226m , ダイニングバー、居酒屋、イタリアン,京橋駅徒歩5分◎黒毛和牛が食べ放題！リーズナブルに値段を気にせずご利用頂けます！,"￥3,000～￥3,999","￥3,000～￥3,999",3.3,,https://tabelog.com/osaka/A2701/A270107/27114374/,予約可,,大阪メトロ長堀鶴見緑地線 京橋駅より徒歩2分京阪 京橋駅より徒歩3分JR 京橋駅より徒歩5分 京橋駅から226m,,,カード可 （VISA、Master、JCB、AMEX、Diners） 電子マネー不可 QRコード決済可 （PayPay）,"34.69793110703676,135.53009890597613",080-2466-4197,大阪府大阪市都島区東野田町2-8-6 KHビル 2F,62
,肉バルGABUTTO 茨木店,茨木駅 83m , 居酒屋、焼肉、イタリアン,忘年会コースご予約お待ちしてます。12月から冬のオススメメニュー開催！,"￥2,000～￥2,999","￥2,000～￥2,999",3.3,,https://tabelog.com/osaka/A2706/A270604/27096361/,予約可,[ご予約のキャンセルについて]仮予約の受付はしておりません。ご予約のキャンセルにつきましては、前営業日の17時までにお願いします。それ以降にキャンセルされますと、次回より予約が取りにくくなりますのでご了承願います。,JR茨木駅東口徒歩30秒！酒のやまやと阪急オアシスのあいだのビルです 茨木駅から83m,11:00 - 14:00L.O. 13:30,■定休日なし,カード可 （VISA、Master、JCB、AMEX、Diners） 電子マネー不可 QRコード決済可 （PayPay、楽天ペイ、au PAY）,"34.8145812379276,135.56239127857737",072-625-1129,大阪府茨木市西中条町1-1 ハタセViビル 1F,59
,タケモト,あびこ駅 78m , イタリアン,,"￥3,000～￥3,999","￥3,000～￥3,999",3.3,水曜日,https://tabelog.com/osaka/A2701/A270404/27002348/,予約可,,地下鉄あびこ駅から徒歩５分 あびこ駅から78m,,,カード不可 電子マネー不可 QRコード決済不可,"34.599110238048915,135.51361167643512",06-6605-6660,大阪府大阪市住吉区苅田7-9-15 アスルシエロ苅田　１Ｆ,52
,VIN de VIN,北新地駅 126m , ワインバー、ビストロ、イタリアン,大人の愉しみ方をご提案。厳選した世界各国のワインを洗練された空間でお愉しみください。,"￥6,000～￥7,999","￥6,000～￥7,999",3.3,,https://tabelog.com/osaka/A2701/A270101/27002051/,予約可,当日予約可※クリスマスコースは当日予約不可,北新地駅より徒歩2分西梅田駅より徒歩5分梅田駅より徒歩7分 北新地駅から126m,18:00 - 02:00L.O. 01:00,■ 定休日日曜日・祝日(GWは営業)・第３月曜日・年末年始,カード可 （VISA、Master、JCB、AMEX、Diners） 電子マネー不可 QRコード決済不可,"34.69733963798124,135.49697917743896",06-6342-1711,大阪府大阪市北区曽根崎新地1-3-3 好陽ビル　１Ｆ,50
,鉄板焼&Restaurant Bar Caro,北新地駅 112m , ステーキ、イタリアン、イタリアン(パスタ),北新地駅すぐ◇まるで映画のワンシーン――。非日常空間で愉しむ鉄板焼きとカジュアルイタリアン,"￥10,000～￥14,999","￥10,000～￥14,999",3.3,,https://tabelog.com/osaka/A2701/A270101/27044736/,予約可,"※【食べログを見た】とご予約を頂くとスムーズです。※電子マネー決済の場合は￥10,000以上のコースをご利用いただいた方のみでご協力をお願いいたします。*Please cooperate only with those who have used a course of ¥10,000 or more for electronic payment.",ＪＲ東西線「北新地駅」より徒歩1分地下鉄四つ橋線「西梅田駅」より徒歩2分ＪＲ「大阪駅」より徒歩5分阪神本線「梅田駅」より徒歩3分 北新地駅から112m,18:00 - 05:00L.O. 04:00,■ 定休日日曜（祝日）,カード可 （VISA、Master、JCB、AMEX、Diners） 電子マネー可 （交通系電子マネー（Suicaなど）、楽天Edy、nanaco、WAON、iD、QUICPay） QRコード決済可 （楽天ペイ、au PAY）,"34.69754443798115,135.49713107744094",06-6342-8882,大阪府大阪市北区曽根崎新地1-3-32 COZY北新地,47
,PerCaffe Bianco,箕面駅 61m , カフェ、イタリアン,,-,-,3.3,月曜日,https://tabelog.com/osaka/A2706/A270603/27013419/,,,阪急電車　箕面線 箕面駅から61m,09:00 - 19:00L.O. 18:40,■ 営業時間ランチ11:00〜15:00,カード可 （JCB、AMEX、Diners） 電子マネー不可 QRコード決済可,"34.8356348378844,135.4687055788557",072-725-7111,大阪府箕面市箕面1-8-1 ,47
,ブッフェ フォールームス あべのキューズモール,阿倍野駅 181m , ビュッフェ、イタリアン(パスタ)、日本料理,,"￥2,000～￥2,999","￥2,000～￥2,999",3.3,-,https://tabelog.com/osaka/A2701/A270203/27085081/,予約可,車椅子でお席につかれる場合は、お手数ですが「コメント欄」に記載をお願いいたします。,【地下鉄】・御堂筋線、谷町線 「天王寺駅」12号出口より直結。徒歩2分。・谷町線 「阿倍野駅」2号出口より直結。徒歩1分。【JR】・環状線、阪和線、大和路線 「天王寺駅」南口より徒歩3分【近鉄】・南大和線 「大阪阿部野橋駅」西改札より徒歩3分【阪堺電車】・上町線 「天王寺駅前駅」徒歩2分 阿倍野駅から181m,11:00 - 22:00,■ 営業時間ディナータイム21:00にて、ご入店ストップ■ 定休日不定休(あべのキューズモールに準ずる),カード可 電子マネー不可 QRコード決済可,"34.64463353801928,135.51134757689653",06-4396-6088,大阪府大阪市阿倍野区阿倍野筋1-6-1 あべのキューズモール 4F,47
,トラットリア　ゼータ,南森町駅 248m , イタリアン、イタリアン(パスタ)、ダイニングバー,,"￥3,000～￥3,999","￥3,000～￥3,999",3.3,-,https://tabelog.com/osaka/A2701/A270103/27068696/,予約可,御予約の入店のお時間や、人数に変動があった際はご連絡くださいませ。よろしくお願いいたします。,大阪駅前第3ビル　東へ約800ｍ南森町駅2番出口　西へ約100ｍ 南森町駅から248m,11:30 - 14:00,■ 定休日不定休,カード可 （VISA、Master、JCB、AMEX、Diners）,"34.69748353798474,135.50827407743253",06-6364-8033,大阪府大阪市北区西天満3-6-22 北大阪 2F,47
,Bistro bar 真琴,北浜駅 121m , イタリアン、イタリアン(パスタ)、ビストロ,,"￥3,000～￥3,999","￥3,000～￥3,999",3.3,-,https://tabelog.com/osaka/A2701/A270102/27062003/,予約可,,北浜駅下車すぐ 北浜駅から121m,17:00 - 23:00L.O. 料理22:00 ドリンク22:30,■ 営業時間水・木のランチはなくなり次第終了土・日・祝日のランチはアラカルトメニューです。詳細はお問い合わせ下さいコース料理・飲み放題・貸切も承っています(人数・シーン・価格etc…ご相談下さい!)■定休日不定休,カード不可 電子マネー不可 QRコード決済不可,"34.69145163798858,135.50827687737157",06-6228-0028,大阪府大阪市中央区北浜1-1-18 忠次郎ビル1F,44
,カパンナ,本町駅 448m , イタリアン、豚料理、ワインバー,,"￥5,000～￥5,999","￥5,000～￥5,999",3.3,-,https://tabelog.com/osaka/A2701/A270102/27084001/,予約可,,本町駅から448m,,,カード可 （VISA、Master、JCB、AMEX、Diners） 電子マネー不可 QRコード決済不可,"34.68666448566223,135.50371260556244",06-6226-7026,大阪府大阪市中央区淡路町2-6-5 1F,43
,肉バル ガブット 吹田店,吹田（ＪＲ）駅 323m , 居酒屋、焼肉、イタリアン,ランチタイム限定 【ワイキキボウル】アサイーボウル始めました！,"￥3,000～￥3,999","￥3,000～￥3,999",3.3,,https://tabelog.com/osaka/A2706/A270602/27114517/,予約可,[ご予約のキャンセルについて]仮予約の受付はしておりません。ご予約のキャンセルにつきましては、前営業日の17時までにお願いします。それ以降のキャンセルされますと、次回より予約が取りにくくなりますのでご了承願います。,JR京都線 吹田駅東改札北出口より徒歩4分吹田駅より約450m 吹田駅（ＪＲ）から323m,11:00 - 14:00L.O. 13:30,■ 定休日年末年始（12/31～1/3）,カード可 （VISA、Master、JCB、AMEX、Diners） 電子マネー可 QRコード決済可 （PayPay、d払い、楽天ペイ、au PAY）,"34.76614223794594,135.5234217781154",06-6821-1129,大阪府吹田市片山町1-5-10 ダイオービル 1F,42
,ビストロFumi,枚方市駅 112m , イタリアン(パスタ)、洋食,BistroFumiは手作りにこだわっています。,"￥2,000～￥2,999","￥2,000～￥2,999",3.3,-,https://tabelog.com/osaka/A2707/A270702/27085132/,予約可,,京阪枚方市駅北口から徒歩1分 枚方市駅から112m,,,カード不可,"34.81578463795401,135.64770667852974",072-841-2030,大阪府枚方市岡本町2-2 豊田ビル 1F,41
,トラットリア L.S.C,堺駅 300m , イタリアン、バル、イタリアン(パスタ),,"￥2,000～￥2,999","￥2,000～￥2,999",3.3,日曜日,https://tabelog.com/osaka/A2705/A270501/27063603/,予約可,【ご予約時に必ずご確認ください】※飲み放題付きコースは4名様よりご注文頂けます。※人数、コース内容の変更は前日までに必ずご連絡くださいませ。※当日キャンセルの場合は、料理代をキャンセル料として頂いております。※4名様以上で、お席のみのご予約のお客様も、当日キャンセルは一律でお一人様2000円頂いております。,2017年6月1日よりリニューアルオープン♬南海本線堺駅、東出口～徒歩5分阪堺電軌阪堺線/大小路駅～徒歩5分 堺駅から300m,,,カード可 （VISA、Master、JCB、AMEX、Diners） 電子マネー不可,"34.58109925454693,135.47195800261255",072-245-9113,大阪府堺市堺区戎島町2-30-2 ターミナルマンション朝日プラザ 1F,40
,isolata,淀屋橋駅 295m , イタリアン、ワインバー、ビストロ,【淀屋橋駅1分】旬の食材を使ったイタリア料理を都心の隠れ家で。,"￥6,000～￥7,999","￥6,000～￥7,999",3.3,,https://tabelog.com/osaka/A2701/A270102/27139332/,完全予約制,苦手やアレルギー食材がある方貸切ご希望の方はコメントに記載お願い致しますベビーカーでお越しの際は事前にお知らせください。,淀屋橋駅から徒歩約2分北浜駅から徒歩約6分北新地駅から徒歩約15分 淀屋橋駅から295m,11:30 - 15:30,■ 営業時間11:30～15:30(最終入店13:30)17:30～19:30（閉店22:00)■ 定休日月曜日　第2、4日曜日,カード可 （VISA、Master、JCB、AMEX、Diners） 電子マネー可 QRコード決済可 （PayPay、d払い、楽天ペイ、au PAY）,"34.689007681513765,135.50198415175433",06-6732-8056,大阪府大阪市中央区伏見町3-3-1 芝川ビル,39
,Naga～n cucina italiana,長堀橋駅 92m , イタリアン,,-,-,3.3,-,https://tabelog.com/osaka/A2701/A270201/27015162/,予約可,ランチは予約不可,地下鉄堺筋線または長堀鶴見緑地線/長堀駅7番出口からスグ 長堀橋駅から92m,,,カード可 （JCB、AMEX、Diners） 電子マネー不可 QRコード決済不可,"34.67374853799912,135.50607177719434",06-6252-5566,大阪府大阪市中央区東心斎橋1-3-7 ＥＮＴ長堀　１Ｆ,39
,AMBER,西大橋駅 264m , イタリアン、肉バル、ビストロ,四ツ橋駅5分◆炭火イタリアンと自然派ワインのマリアージュが魅力のバル,"￥4,000～￥4,999","￥4,000～￥4,999",3.3,,https://tabelog.com/osaka/A2701/A270201/27140944/,予約可,・ご予約日当日までに人数変更（増減どちらでも）がございましたら事前に店舗までご連絡いただくようお願いいたします。無断キャンセルや連絡なしの人数変更の場合、キャンセル料を頂戴します。・当店のディナーでは、「ワインやカクテルなどお酒と一緒に料理を楽しんでいただきたい」という思いがありますので、お酒が飲めないお客様はなるべくお酒が飲める方とご来店いただけますと幸いです。,四ツ橋駅、西大橋駅から徒歩5分心斎橋駅から徒歩11分 西大橋駅から264m,11:30 - 15:30L.O. 14:30,月曜が祝日の場合は翌火曜がお休みになります。第１、第３火曜はお休み、その他不定休の場合もございます。正確な営業日はインスタグラムのハイライトにてご確認ください。,カード可 （VISA、Master、JCB、AMEX、Diners） 電子マネー可 （交通系電子マネー（Suicaなど）、楽天Edy、nanaco、WAON、iD、QUICPay） QRコード決済可 （PayPay、d払い、楽天ペイ、au PAY）,"34.67340723575316,135.4922545669572",06-6964-8190,大阪府大阪市西区北堀江2-4-20 ハイフォレスト1,38
,フェルマータ,野田阪神駅 232m , イタリアン、バー、イタリアン(パスタ),,"￥5,000～￥5,999","￥5,000～￥5,999",3.3,-,https://tabelog.com/osaka/A2701/A270108/27017615/,予約可,,大阪市営地下鉄　千日前線　野田阪神駅　7番出口　徒歩2分阪神本線　野田駅　南西へ徒歩3分JR　東西線　海老江駅　南西へ徒歩5分JR　環状線　野田駅　北東へ徒歩5分大阪市営地下鉄　千日前線　玉川駅北へ徒歩5分 野田阪神駅から232m,,,カード可 （JCB、AMEX、Diners） 電子マネー不可 QRコード決済可 （PayPay）,"34.69219263797758,135.47522287740222",06-6441-6673,大阪府大阪市福島区吉野2-10-12 ゴールデンラビス 1F,37
,ピッツァフォルトゥーナ,都島駅 204m , イタリアン(ピザ)、イタリアン、バル,,"￥3,000～￥3,999","￥3,000～￥3,999",3.3,-,https://tabelog.com/osaka/A2701/A270304/27106462/,予約可,★不定休★ご予約の無い日は予告なく臨時休業の可能性がございます。ーーーーーーーーーーーーーーーーーーーーーーーーーーー★ホームページ予約特典★備考欄にてご希望のクーポン番号を記載くださいーーーーーーーーーーーーーーーーーーーーーーーーーーー■お昼の営業について■※ランチメニューはありません。単品料理のみ※ディナー同様、ご予約人数×350円のお突き出し有り,大阪メトロ谷町線「都島駅」約徒歩４分、大阪環状線「桜ノ宮駅」徒歩約６分都島駅２番出口。ご予約はホームページのネット予約から承っています。 都島駅から204m,17:00 - 22:00L.O. 料理21:00 ドリンク21:30,★不定休★ご予約の無い日は予告なく臨時休業の可能性がございます。ーーーーーーーーーーーーーーーーーーーーーーーーーーー★ホームページ予約特典★備考欄にてご希望のクーポン番号を記載お願いしますーーーーーーーーーーーーーーーーーーーーーーーーーーー■お昼の営業について■※昼・夜共通メニュー。単品料理のご提供のみとなっております。※ディナー同様、ご予約人数×350円のお突き出しがございます（お子様含む）,カード可 （VISA、Master、JCB、AMEX、Diners） 電子マネー可 （交通系電子マネー（Suicaなど）、iD、QUICPay） QRコード決済可 （PayPay、d払い、楽天ペイ、au PAY、Alipay、WeChat Pay）,"34.707170737984214,135.52595577751796",070-1819-6135,大阪府大阪市都島区都島本通2-9-14 ,37
,trattoria Fiero,北浜駅 500m , イタリアン、イタリアン(パスタ)、バル,北浜駅4分◆イタリア人シェフ渾身の魚介を中心とした本格イタリアンを堪能◎新年会受付中！,"￥4,000～￥4,999","￥4,000～￥4,999",3.3,,https://tabelog.com/osaka/A2701/A270102/27133776/,予約可,　ディナー：フードラストオーダー22:30　　　　　　ドリンクラストオーダー23:00,北浜駅、6番出口から徒歩4分堺筋本町駅、17番出口から徒歩7分淀屋橋駅、11番出口から7分 北浜駅から500m,,,カード可 （VISA、Master、JCB、AMEX、Diners） 電子マネー不可 QRコード決済不可,"34.68736293799033,135.50564987733213",06-6226-0202,大阪府大阪市中央区平野町2-2-2 ,37
,パパ・ヘミングウェイ,深井駅 502m , イタリアン、創作料理、日本料理,結婚式場内にある隠れ家的存在の創作イタリアン。,"￥4,000～￥4,999","￥4,000～￥4,999",3.3,-,https://tabelog.com/osaka/A2705/A270501/27052137/,予約可,,泉北高速「深井駅」より徒歩7分 深井駅から502m,,,カード可 （VISA、Master、JCB、AMEX） 電子マネー不可 QRコード決済可 （PayPay）,"34.53312033808708,135.50182897577682",0120-807-727,大阪府堺市中区深井水池町3238 サンパレス2F,36
,路地裏食堂 マチュナガ,中崎町駅 202m , イタリアン、創作料理、イタリアン(パスタ),,"￥2,000～￥2,999","￥2,000～￥2,999",3.3,月曜日,https://tabelog.com/osaka/A2701/A270101/27115888/,予約可,◆当日予約は20時まで,大阪メトロ谷町線　「中崎町」駅4番出口　徒歩10分 大阪メトロ御堂筋線　「梅田駅」　徒歩15分～JR「大阪駅」　徒歩20分～ 中崎町駅から202m,11:30 - 15:00L.O. 14:30,■ 定休日月曜日(祝日の場合火曜日),カード可 （VISA、Master、JCB、Diners） 電子マネー可 （交通系電子マネー（Suicaなど）、iD、QUICPay）,"34.70837823797643,135.5039215775456",050-1556-4663,大阪府大阪市北区中崎西1-9-22 ,35
,Oggi 和泉店,和泉府中駅 707m , イタリアン、イタリアン(パスタ)、イタリアン(ピザ),,"￥2,000～￥2,999","￥2,000～￥2,999",3.3,木曜日,https://tabelog.com/osaka/A2705/A270502/27097940/,予約可,,JR和泉府中駅より徒歩10分 和泉府中駅から707m,,,カード可 （VISA、Master、JCB、AMEX、Diners） 電子マネー不可,"34.4830657380956,135.4288011753224",072-599-8505,大阪府和泉市府中町4-8-41 ,34
,月曜から葡萄酒,大阪城北詰駅 272m , バル、ビストロ、イタリアン(パスタ),京橋駅3分！原価でシャンパンが飲める京橋の隠れ家ビストロ◆深夜2時まで営業中♪コースあり〼,"￥4,000～￥4,999","￥4,000～￥4,999",3.3,,https://tabelog.com/osaka/A2701/A270107/27137349/,予約可,,JR京橋駅より徒歩7分京阪京橋駅より徒歩3分地下鉄京橋駅より徒歩4分 大阪城北詰駅から272m,17:00 - 02:00,日曜日はbar営業です。お料理はワインに合うおつまみをご用意メイン料理にパスタ、ピザがあります。木、金、土曜日ランチ営業しています。,カード可 （VISA、Master、JCB、AMEX、Diners） 電子マネー可 （交通系電子マネー（Suicaなど）） QRコード決済可 （PayPay、d払い、楽天ペイ、au PAY）,"34.6943847957022,135.5287258499536",06-7777-5785,大阪府大阪市都島区片町2-7-12 オークランドビル 1F,34
,レストラン センカ,大阪空港駅 346m , イタリアン、フレンチ、イタリアン(パスタ),,"￥2,000～￥2,999","￥2,000～￥2,999",3.3,日曜日,https://tabelog.com/osaka/A2706/A270601/27052123/,予約可,,大阪空港駅から346m,06:30 - 09:30,■ 定休日営業の場合も有　要お問い合わせください,カード可 （VISA、Master、JCB、AMEX、Diners）,"34.79450979262557,135.4419428917763",06-6842-1100,大阪府池田市空港1‐9‐6 グリーンリッチホテル大阪空港前（伊丹）１F,33
