awards,name,station,genre,pr,dinner_budget,lunch_budget,rating,holiday,url,reserve_status,reserve_method,transportation,opening_time,extra_holiday_info,payment_methods,geo_coordinates,telephone,address,num_review
,PESCA なんば店,難波（南海）駅 138m , イタリアン、フレンチ、ダイニングバー,【特別な日に】 モダン&クラシックな寛ぎのある空間 今年もクリスマスコースご予約開始致しました,"￥5,000～￥5,999","￥5,000～￥5,999",3.48,,https://tabelog.com/osaka/A2701/A270202/27072217/,予約可,パーティー用サービスなどお気軽にご相談ください。,地下鉄御堂筋線 なんば駅 徒歩1分南海本線 難波駅 徒歩1分南海高野線 難波駅 徒歩1分近鉄難波線 大阪難波駅 徒歩1分阪神なんば線 大阪難波駅 徒歩1分地下鉄千日前線 日本橋駅 徒歩7分近鉄難波線 近鉄日本橋駅 徒歩7分 難波駅（南海）から138m,,,カード可 （VISA、Master、JCB、AMEX、Diners） 電子マネー可 QRコード決済不可,"34.663732338004586,135.5032934770951",06-6641-1678,大阪府大阪市中央区難波千日前14-20 ,354
,アマーク ド パラディ,四ツ橋駅 236m , ビストロ、カフェ、イタリアン,心斎橋・南船場◆旬の食材を活かした料理とワインが楽しめるモダンビストロ,"￥3,000～￥3,999","￥3,000～￥3,999",3.48,,https://tabelog.com/osaka/A2701/A270201/27000936/,予約可,,・大阪市営地下鉄御堂筋線「心斎橋駅」3番出口から徒歩3分・大阪市営地下鉄四つ橋線「四ツ橋駅」1A出口から徒歩3分 四ツ橋駅から236m,,,カード可 （VISA、Master、JCB、AMEX、Diners） 電子マネー可 （交通系電子マネー（Suicaなど）、楽天Edy、nanaco、WAON、iD、QUICPay） QRコード決済可 （PayPay）,"34.67585303799533,135.49838117722098",06-6252-3341,大阪府大阪市中央区南船場4-12-21 １Ｆ・２Ｆ,328
,TRATTORIA AL POMPIERE,梅田駅 93m , イタリアン、イタリアン(パスタ)、カフェ,ヴェローナ本店の伝統を味わうひととき。忘年会・クリスマス・新年会などご予約受付中です。,"￥5,000～￥5,999","￥5,000～￥5,999",3.48,,https://tabelog.com/osaka/A2701/A270101/27068655/,予約可,団体様・貸切のお問合せについては公式ホームページの問い合わせフォームにて承っておりますのでぜひご利用ください。お電話はAIが応答いたします。「ご予約ですか」→「はい」「何日の何時のご予約ですか」→「4月1日の19時」といったように会話形式でご用件を承ります。,阪急線 梅田駅 徒歩2分 阪神本線 梅田駅 徒歩2分 ＪＲ 大阪駅 徒歩3分 地下鉄御堂筋線 梅田駅 徒歩2分 梅田駅から93m,11:00 - 22:00,■ 営業時間11:00～22:00（L.o21:00）■ 定休日なし（阪急うめだ本店に準ずる）,カード可 （VISA、Master、JCB、AMEX、Diners） 電子マネー可 （交通系電子マネー（Suicaなど）、楽天Edy、iD、QUICPay） QRコード決済可 （PayPay、d払い、楽天ペイ、au PAY）,"34.70305993797815,135.49873577749554",050-3201-3869,大阪府大阪市北区角田町8-7 阪急うめだ本店 13F,309
,ダイヤモンドカリー,東梅田駅 184m , カレー、イタリアン(パスタ),,～￥999,～￥999,3.48,-,https://tabelog.com/osaka/A2701/A270101/27090355/,予約不可,,JR 東西線 北新地駅 徒歩約3分JR 各線 大阪駅 徒歩約10分大阪メトロ御堂筋線 梅田駅 徒歩約5分大阪メトロ谷町線 東梅田駅 徒歩約5分 東梅田駅から184m,11:00 - 18:00L.O. 17:30,■ 定休日不定休,カード不可 電子マネー可 QRコード決済可,"34.69903453798098,135.4995774774543",06-6341-7726,大阪府大阪市北区梅田1-1-3 大阪駅前第三ビル B1F,295
,アンティカ・オステリア・ダル・ポンピエーレ,肥後橋駅 199m , イタリアン、イタリアン(ピザ)、イタリアン(パスタ),忘年会予約受付中！予算、人数など気軽にお電話にてお問い合わせ下さい◆本格イタリアン&ワイン,"￥6,000～￥7,999","￥6,000～￥7,999",3.48,,https://tabelog.com/osaka/A2701/A270102/27004772/,予約可,※営業時間内のお電話でのご予約は対応できない場合がございます。予めご了承ください。※席のみ予約は4名様までに限り受け付けております。何卒、ご理解・ご了承の程をよろしくお願いいたします。※小学生以下のお子様連れのお客様は個室でのご利用をお願いしております。なお、個室が満席の場合はお断りさせていただく場合がございます。※コース、アラカルトに関わらず揃い次第で料理の提供開始となります。,地下鉄御堂筋線　淀屋橋駅下車徒歩５分地下鉄四ツ橋線　肥後橋駅　下車徒歩５分京阪中之島線　渡辺橋駅　下車徒歩５分 肥後橋駅から199m,11:30 - 15:00L.O. 14:00,■ 営業時間〈営業・テイクアウト受付時間〉お待ちしております。,カード可 （VISA、Master、JCB、AMEX、Diners） 電子マネー不可 QRコード決済不可,"34.69065443798597,135.49853477737037",06-4706-1199,大阪府大阪市中央区今橋4-5-19 ,294
,PASTA&FACTORY collectons,本町駅 264m , イタリアン(パスタ)、イタリアン、ダイニングバー,山根屋から⇒COLLECTONS（コレクトンズ）へ！ファクトリー併設生パスタ専門店。,-,-,3.48,日曜日,https://tabelog.com/osaka/A2701/A270106/27019420/,予約不可,,御堂筋本町駅、堺筋本町駅から徒歩5分三休橋筋沿い 本町駅から264m,11:00 - 15:00L.O. 14:30,予約不可です。■ 定休日日曜日　年末年始,カード可 （VISA、Master、JCB、AMEX） 電子マネー不可 QRコード決済可 （PayPay、d払い、楽天ペイ、au PAY）,"34.68287163799247,135.50342957728833",06-6732-8095,大阪府大阪市中央区南本町3-1-3 ２Ｆ,280
,中崎パスタ店 山根屋,中崎町駅 161m , イタリアン(パスタ)、イタリアン(ピザ)、イタリアン,【パスタ専門店】保存料を一切使用しないこだりのもちもちの自家製生パスタを是非ご賞味ください,"￥2,000～￥2,999","￥2,000～￥2,999",3.48,-,https://tabelog.com/osaka/A2701/A270101/27088840/,予約不可,,中崎町駅 徒歩3分 中崎町駅から161m,11:00 - 15:00L.O. 14:30,■ 定休日不定休,カード可 （VISA、Master、JCB、AMEX、Diners） 電子マネー不可 QRコード決済可 （PayPay）,"34.70829423797711,135.5058698775434",06-6459-7960,大阪府大阪市北区中崎2-3-9 ,277
,ガフーリオ,近鉄日本橋駅 108m , イタリアン、バル、イタリアン(パスタ),隠れ家イタリアンで絶品料理をご堪能ください。,"￥5,000～￥5,999","￥5,000～￥5,999",3.48,,https://tabelog.com/osaka/A2701/A270202/27004243/,予約可,※予約時間迄にご来店が難しい場合は店舗06-6635-0055までご連絡ください。※15分以上遅れますと自動キャンセルの扱いとさせて頂きますので予めご了承ください。※以下のお時間はご予約の際、電話回線が混み合いつながりにくい場合がございます。・11時30分〜14時30分・15時30分〜17時・17時30分〜22時,堺筋線日本橋駅（5番出口）より徒歩2分御堂筋線なんば駅より徒歩4分近鉄日本橋駅より107m 近鉄日本橋駅から108m,,,カード可 （VISA、Master、JCB、AMEX） 電子マネー可 QRコード決済可 （PayPay、d払い、au PAY）,"34.66610803800376,135.50539977711762",06-6635-0055,大阪府大阪市中央区千日前2-3-1 セブンマンション　１０３,274
,オイスタールーム 梅田ハービスエント店,西梅田駅 140m , オイスターバー、ダイニングバー、イタリアン,ハービスPLAZA ENT 5F [期間限定]お得なランチコースや半額プレートフェア等必見♪,"￥6,000～￥7,999","￥6,000～￥7,999",3.48,,https://tabelog.com/osaka/A2701/A270101/27076539/,予約可,【席のみ予約について】ランチ：お席は90分制となります。ディナー：お席は120分制となります。ご予約のお時間に15分以上遅れ、ご連絡が無い場合はキャンセル扱いとなります。【キャンセルについて】無断キャンセルはお避け下さい。前日までにメール、または直接店舗へご連絡をお願いいたします。,地下鉄御堂筋線 梅田駅 徒歩5分 ＪＲ 大阪駅 桜橋口 徒歩2分 西梅田駅から140m,11:00 - 15:00L.O. 14:30,■ 定休日店休日：不定休（ハービスエントの休業日に準ずる）,カード可 （VISA、Master、JCB、AMEX） 電子マネー可 （交通系電子マネー（Suicaなど）、楽天Edy、WAON、iD、QUICPay） QRコード決済可 （PayPay、d払い、楽天ペイ、au PAY）,"34.69954336232284,135.49415626122232",06-6451-5118,大阪府大阪市北区梅田2-2-22 ハービスPLAZA ENT 5F,266
,レストラン　ミツヤマ,堺筋本町駅 257m , イタリアン,,"￥10,000～￥14,999","￥10,000～￥14,999",3.48,日曜日,https://tabelog.com/osaka/A2701/A270106/27004543/,予約不可,,地下鉄堺筋本町駅 11番出口より南へ徒歩3分2つ目の角左手 堺筋本町駅から257m,11:00 - 14:00,■ 定休日祝日の月曜日 8/21~8/25,カード可 （VISA、Master、JCB、AMEX、Diners） 電子マネー不可 QRコード決済不可,"34.68004243799494,135.50555837725824",06-6263-0328,大阪府大阪市中央区北久宝寺町2-1-11 アライアンス船場　１Ｆ,249
,Pizzeria Pancia Piena,池田駅 270m , イタリアン(ピザ)、イタリアン,,"￥3,000～￥3,999","￥3,000～￥3,999",3.48,月曜日,https://tabelog.com/osaka/A2706/A270603/27013677/,予約可,,阪急池田駅より徒歩７分阪神高速 川西小花ＩＣより、車で５分 池田駅から270m,,,カード不可 電子マネー不可 QRコード決済不可,"34.82393343787842,135.426610378767",072-754-5564,大阪府池田市栄本町1-1 ,240
,大衆ビストロ さしす 天王寺MIO店,天王寺駅 164m , フレンチ、イタリアン、居酒屋,天王寺駅1分◆人気系列店の新業態！フレンチと和を融合した逸品を◎予約は承っておりません,"￥3,000～￥3,999","￥3,000～￥3,999",3.48,-,https://tabelog.com/osaka/A2701/A270203/27128393/,予約不可,,天王寺駅すぐMIO プラザ館 M2F M210 天王寺駅から164m,11:00 - 23:00L.O. 22:30,■ 定休日MIOに準ずる（12月31日、1月1日は休業）,カード可 電子マネー可 QRコード決済不可,"34.64766333801822,135.5140715769252",06-6776-8220,大阪府大阪市天王寺区悲田院町10-48 プラザ館 M2F M210,239
,パシオン・エ・ナチュール 新大阪駅店,新大阪駅 113m , ダイニングバー、ワインバー、イタリアン,【新大阪駅直結】300種以上の自然派ワインと出来立ての手作り料理を堪能◎気軽に過ごせる店内,"￥4,000～￥4,999","￥4,000～￥4,999",3.48,,https://tabelog.com/osaka/A2701/A270301/27053794/,予約可,,大阪メトロ御堂筋線「新大阪」駅 中改札口⑤出てすぐJR新大阪駅から地下鉄御堂筋線新大阪駅方面へアルデ新大阪内（2Fです） 新大阪駅から113m,10:30 - 22:30L.O. 料理21:30 ドリンク22:00,■定休日施設に準ずる,カード可 （VISA、Master、JCB、AMEX、Diners） 電子マネー可 （交通系電子マネー（Suicaなど）、楽天Edy、nanaco、WAON、iD、QUICPay） QRコード決済可 （PayPay、d払い、楽天ペイ、au PAY）,"34.73278183962295,135.4991979232638",06-6300-1159,大阪府大阪市淀川区西中島5-16-1 アルデ新大阪,190
,ぱんろーど しらとりの郷店,羽曳野市 , パン、カフェ、イタリアン(パスタ),,-,-,3.48,木曜日,https://tabelog.com/osaka/A2708/A270801/27015728/,予約不可,パンの予約はできるけど、カフェの予約はできない,"近鉄南大阪線喜志駅より徒歩20分。道の駅「しらとりの郷」内。 喜志駅から2,131m",07:00 - 18:00,■ 営業時間07:00～18:30カフェは11:00より営業 L.O.18:0011:00～15:00L.O.15:00パンのイートインはすべての時間帯でOK,カード可 （VISA、Master、JCB、AMEX） 電子マネー可 QRコード決済可 （PayPay）,"34.53323343811441,135.58788947571765",072-957-8800,大阪府羽曳野市埴生野975-3 ,133
,ピエーノ ヴィラ,大阪難波駅 201m , イタリアン、バル、バー,PIENO屈指のシェフがお届けする料理とチーズと豊富なワイン♪ちょっと大人の「PIENO」,"￥3,000～￥3,999","￥3,000～￥3,999",3.48,,https://tabelog.com/osaka/A2701/A270202/27031670/,予約可,,ＪＲ難波駅 10番出口 徒歩2分 地下鉄御堂筋線なんば駅 10番出口 徒歩2分 近鉄難波線大阪難波駅 10番出口 徒歩2分 南海本線難波駅 10番出口 徒歩2分 阪神なんば線大阪難波駅 徒歩3分 大阪難波駅から201m,18:00 - 00:00L.O. 23:30,■ 定休日木曜（※祝日、祝前日の場合営業しております。）,カード可 （VISA、Master、JCB、AMEX、Diners） 電子マネー不可 QRコード決済可 （PayPay）,"34.66544023800227,135.49942187711505",06-6633-0147,大阪府大阪市中央区難波4-5-8 南地ターミナルビルB1F,109
,DREAM ON TAIGA,中崎町駅 235m , バル、居酒屋、イタリアン,【ハイクオリティの料理をコスパ良く】有名店超えと評判？！のカジュアルイタリアンバル,"￥4,000～￥4,999","￥4,000～￥4,999",3.48,,https://tabelog.com/osaka/A2701/A270101/27105491/,予約可,◆無断キャンセルの場合（平均客単価5000円×予約人数）×110％（請求代理店手数料10％）を頂戴させていただきます。◆人数変更・予約時間に遅れる場合はお電話にて事前のご連絡をお願い致します。◆ご来店頂いてからの人数減はいかなる理由であっても、キャンセル料金1名×5000円を頂戴いたします◆7名様以上はお電話でのご予約をお願い致します。,◆地下鉄谷町線　【中崎町駅】⇒ 徒歩2分　【天神橋筋六丁目駅】⇒ 徒歩6分◆JR　【天満駅】⇒ 徒歩8分◆地下鉄堺筋線　【扇町駅】⇒ 徒歩10分　◆ＪＲ・地下鉄　【梅田駅】⇒ 徒歩15分 中崎町駅から235m,17:00 - 23:00L.O. 料理22:00 ドリンク22:30,＜年末年始営業体制＞年末年始も営業いたします！12月26日(木)：臨時休業12月27日(金)～29日(日)：16時～23時12月30日(月)：15時～23時12月31日(火)：15時～22時2025年1月1日(水)～3日(金)：14時～21時,カード可 （VISA、Master、JCB、AMEX、Diners） 電子マネー不可 QRコード決済可 （PayPay、d払い、楽天ペイ）,"34.70734023797831,135.50778387753243",06-6467-8020,大阪府大阪市北区黒崎町3-22 ,97
,ヴィヴァッカス,本町駅 426m , イタリアン、ワインバー,テーブルで仕上げる華やかなお料理が会食、記念日ディナーに大好評。ワインも豊富で個室完備。,"￥8,000～￥9,999","￥8,000～￥9,999",3.48,,https://tabelog.com/osaka/A2701/A270102/27064361/,予約可,※ご予約時にお電話がつながりにくい場合がございます。　その際は、WEB予約でご予約をいただけますようお願い致します。,地下鉄御堂筋線「本町駅」1番出口より徒歩5分地下鉄御堂筋線「淀屋橋駅」11番出口より徒歩5分地下鉄堺筋線「北浜駅」6番出口より徒歩5分地下鉄堺筋線「堺筋本町駅」17番出口より徒歩5分 本町駅から426m,17:00 - 23:00L.O. 22:00,■ 営業時間[月曜日～金曜日]17：00～23：00（LO22:00）土曜日17：00-22：00（LO21:00）■ 定休日曜日・祝日※その他不定休日あり,カード可 （VISA、Master、JCB、AMEX、Diners） 電子マネー不可 QRコード決済可 （PayPay）,"34.6867644379899,135.50313987732787",06-6233-3770,大阪府大阪市中央区淡路町3-2-8 トーア紡第二ビル　 B1,66
,PotaLa,天神橋筋六丁目駅 252m , イタリアン、バル、イタリアン(パスタ),,"￥4,000～￥4,999","￥4,000～￥4,999",3.48,-,https://tabelog.com/osaka/A2701/A270103/27137077/,予約可,,天神橋筋六丁目駅1番出口から徒歩3分 天神橋筋六丁目駅から252m,,,カード可 電子マネー可 QRコード決済可,"34.709824137978565,135.5135022775535",06-6867-7674,大阪府大阪市北区菅栄町13-19 アーカスシティ天六別館 1F,40
,BELLA BOCCA 阪急梅田店,大阪梅田（阪急）駅 94m , ダイニングバー、イタリアン、居酒屋,★梅田駅2分★ 自社農園の無農薬有機野菜・こだわり素材が自慢のイタリアンバル【忘年会受付中】,"￥3,000～￥3,999","￥3,000～￥3,999",3.47,,https://tabelog.com/osaka/A2701/A270101/27066961/,予約可,,阪急線 梅田駅 徒歩2分 地下鉄御堂筋線 梅田駅 徒歩2分 ＪＲ 大阪駅 徒歩3分 大阪梅田駅（阪急）から94m,11:30 - 14:30L.O. 14:00,■ 営業時間【営業時間変更のお知らせ】皆様のご来店お待ちしております！！2022/5/10更新■ 定休日【梅田駅2分！】有機野菜とワインが自慢のイタリアン★　自社農園直送 こだわりの食材をイタリア人シェフが調理してます！本場のレシピを使った｢ティラミス｣は絶品★,カード可 （VISA、Master、JCB、AMEX） 電子マネー不可 QRコード決済可 （PayPay）,"34.70609133797583,135.49747357752702",06-6373-6277,大阪府大阪市北区芝田1-3-13 B1F,549
,青いナポリ イン・ザ・パーク,天王寺駅前駅 238m , イタリアン、イタリアン(ピザ)、カフェ,てんしばにあるカジュアルイタリアン♪緑に囲まれたテラス席で窯焼きピッツア！天王寺駅直結,"￥3,000～￥3,999","￥3,000～￥3,999",3.47,,https://tabelog.com/osaka/A2701/A270203/27088242/,予約可,予約をキャンセル、変更（人数の減少やコースの取りやめなど）する場合は、以下の通りとなります。コース予約3日前キャンセル -- 100％席のみ予約（1名あたり）当日キャンセル（連絡なし） -- 3000円,地下鉄天王寺駅から21番出口を出てすぐ。 天王寺駅前駅から238m,11:00 - 22:00L.O. 21:00,■ 定休日年末年始　施設に準ずる,カード可 （VISA、Master、JCB、AMEX、Diners） 電子マネー可 （交通系電子マネー（Suicaなど）、楽天Edy、WAON、iD、QUICPay） QRコード決済可 （PayPay）,"34.64805283801735,135.51209557693056",06-6773-2225,大阪府大阪市天王寺区茶臼山町5-55 てんしば,516
,ムーラン,なんば（大阪メトロ）駅 274m , イタリアン、ビアガーデン、バーベキュー,【全80種類の飲み放題プラン多数♪】団体様・パーティのご予約もお問合せください！,"￥3,000～￥3,999","￥3,000～￥3,999",3.47,,https://tabelog.com/osaka/A2701/A270202/27017005/,予約可,ご予約のキャンセル、人数変更は2日前とさせていただきます。それ以降のキャンセルはお食事代金は頂きますので、予めご了承のほど、何卒宜しくお願いいたします。,地下鉄四つ橋線四ツ橋駅 徒歩2分/御堂筋線なんば駅 徒歩5分/南海本線難波駅 徒歩7分/近鉄難波線近鉄難波駅 徒歩3分/JR難波駅　徒歩2分 なんば駅（大阪メトロ）から274m,11:30 - 22:00,■ 営業時間LUNCH /11:30～15:00（l.o.）（土日祝11:00開店）DINNER / 17:00～21:00（l.o.）CAFE / 11:30～21:00（l.o.）（土日祝11:00開店）■ 定休日無休,カード可 （VISA、Master、JCB、AMEX、Diners） 電子マネー可 （交通系電子マネー（Suicaなど）、楽天Edy、iD、QUICPay） QRコード決済不可,"34.6694119379987,135.4961372771575",06-6532-9880,大阪府大阪市西区南堀江1-5-26 キャナルテラス １Ｆ,478
,ゼックスウエスト ザ バー,西梅田駅 99m , イタリアン、バー、バル,【梅田・大阪駅直結「ハービスPLAZA ENT」最上階】9/14リニューアルオープン,"￥5,000～￥5,999","￥5,000～￥5,999",3.47,,https://tabelog.com/osaka/A2701/A270101/27003895/,予約可,,阪神線「梅田駅」西改札/地下鉄四つ橋線「西梅田駅」北改札からすぐJR「大阪駅」桜橋口から徒歩2分ハービスPLAZA　ENT　7F（ウエストエレベーター） 西梅田駅から99m,11:00 - 00:00L.O. 料理23:00,■ 営業時間【Lunch・Cafe】月～金　11:00～18:00 (一部メニュー　LO 14:00)土日祝　11:00～17:30 (一部メニュー　LO 14:00)【Dinner】月～金　18:00～24:00（LO　23:00）土日祝　17:30～24：00（LO　23:00）■ 定休日不定休（ハービスPLAZA ENTに準ずる）,カード可 （VISA、Master、JCB、AMEX、Diners） 電子マネー不可 QRコード決済不可,"34.69967280047638,135.49458871934712",06-4795-0065,大阪府大阪市北区梅田2-2-22 ハービスPLAZA ENT 7F,403
,魚deバール　ウオチカ。,梅田駅 205m , バル、イタリアン、海鮮,【各線梅田駅直結】新鮮な魚料理とワインを愉しむコバコバル,"￥2,000～￥2,999","￥2,000～￥2,999",3.47,,https://tabelog.com/osaka/A2701/A270101/27058117/,予約可,,大阪メトロ御堂筋線 梅田駅 徒歩約3分大阪メトロ谷町線 東梅田駅 徒歩約3分阪急各線 大阪梅田駅 徒歩約3分JR各線 大阪駅 徒歩約5分 梅田駅から205m,11:00 - 23:00,■ 営業時間ランチ 11:00～14:00■ 定休日不定休（Whityうめだに準ずる）,カード可 電子マネー可 （交通系電子マネー（Suicaなど）、楽天Edy、WAON、iD） QRコード決済可,"34.70279617085266,135.49993257617916",06-6311-4782,大阪府大阪市北区角田町梅田地下街2-8 WHITYうめだノースモール2,389
,IL PINOLO 梅田,西梅田駅 39m , イタリアン、イタリアン(パスタ)、レストラン,忘年会新年会のご予約開始しております♪,"￥8,000～￥9,999","￥8,000～￥9,999",3.47,,https://tabelog.com/osaka/A2701/A270101/27002050/,予約可,,地下鉄四つ橋線西梅田駅 徒歩1分 地下鉄御堂筋線梅田駅 徒歩3分 地下鉄谷町線東梅田駅 徒歩5分 ＪＲ大阪駅 徒歩3分 ＪＲ東西線北新地駅 徒歩3分 阪神本線梅田駅 徒歩1分 阪急線梅田駅 徒歩8分 西梅田駅から39m,11:00 - 15:00,■ 定休日ビルに準ずる（年2回　元旦　6月第一月曜日）,カード可 （VISA、Master、JCB、AMEX、Diners） 電子マネー不可 QRコード決済可 （PayPay）,"34.69991463797909,135.4953748774661",06-6342-0080,大阪府大阪市北区梅田2-2-2 ヒルトンプラザウエスト 5F,367
,魚イタリアン&オイスター Rovin 京橋,京橋駅 114m , イタリアン、オイスターバー、イタリアン(パスタ),生牡蠣。それは季節を味わうということ。京橋最大級のオイスターバー。,"￥4,000～￥4,999","￥4,000～￥4,999",3.47,,https://tabelog.com/osaka/A2701/A270107/27097300/,予約可,ご人数様が変更になる可能性がある場合につきましては、最大のご人数様でのお問い合わせをお願いいたします。万が一当日ご人数が増えられる場合には、ご案内できかねる場合がございます。,京阪/大阪環状線/長堀鶴見緑地線各線京橋駅下車後京阪モール直結一切雨に濡れずにご来店いただけます。 京橋駅から114m,11:00 - 17:00,■ 営業時間【ランチ】11：00～15：00（L.O.14:30）【昼呑み】11：00～17：00※新型コロナ感染拡大防止の為、行政の要請に準じます。ご不明点、ご予約はお気軽に店舗までお問合せください。■ 定休日不定休（京阪モールに準ずる）,カード可 （VISA、Master、JCB、AMEX、Diners） 電子マネー不可 QRコード決済可 （PayPay、d払い、楽天ペイ、au PAY）,"34.696664946342025,135.53121873566167",06-6353-7789,大阪府大阪市都島区東野田町2-1-38 京阪モール本館 1F,307
,テーブル36,難波（南海）駅 42m , イタリアン、ダイニングバー、洋菓子,,"￥6,000～￥7,999","￥6,000～￥7,999",3.47,-,https://tabelog.com/osaka/A2701/A270202/27002603/,予約可,ネット予約であれば24時間受付可能となっております。ぜひご利用下さい。,■電車のご案内南海電鉄なんば駅直結。（3階改札口より専用エスカレーター有） 地下鉄御堂筋線・四つ橋線・千日前線なんば駅、近鉄・阪神大阪難波駅下車すぐ。（4番、5番出口） 地下鉄御堂筋線利用により、JR新大阪駅からは15分、大阪駅（梅田駅）からは10分。 ■お車のご利用阪神高速道頓堀出口・湊町出口から約10分。 難波駅（南海）から42m,06:30 - 10:30L.O. 10:00,■ 営業時間[スイーツブッフェ 土日限定]15:30～17:00（16:30L.O）[ディナーブッフェ 土曜限定]18:00～21:00(20:30L.O)■ 定休日平日はスイーツブッフェの営業がございません。土曜日以外は当面の間ディナー営業を自粛させていただいております。,カード可 （VISA、Master、JCB、AMEX、Diners） 電子マネー不可,"34.66390008128072,135.50152729014079",06-6646-5125,大阪府大阪市中央区難波5-1-60 スイスホテル南海大阪 36F,283
