awards,name,station,genre,pr,dinner_budget,lunch_budget,rating,holiday,url,reserve_status,reserve_method,transportation,opening_time,extra_holiday_info,payment_methods,geo_coordinates,telephone,address,num_review
,本町ビストロ ボンヴァン,本町駅 250m , ビストロ、イタリアン、カフェ,【本町駅徒歩3分】味。ボリューム。大満足のおしゃれなビストロ！ランチも営業しております,"￥3,000～￥3,999","￥3,000～￥3,999",3.39,,https://tabelog.com/osaka/A2701/A270106/27102112/,予約可,◆ご予約の最終確認は電話にて実施しております。最終確認が取れた時点でご予約を確定させていただきます。◆貸し切り予約に関してのみ、最終の人数確定をご予約の５日前までとさせていただいております。20名様未満になることが見込まれる場合に関しましては貸し切りのご要望をお受けできなくなることもございます。予めご了承願います。アレルギーがございましたらお伝えください。,地下鉄中央線 本町駅 徒歩3分地下鉄御堂筋線 本町駅 徒歩3分地下鉄四つ橋線 四ツ橋駅 徒歩7分地下鉄中央線 堺筋本町駅 徒歩3分地下鉄堺筋線 堺筋本町駅 徒歩3分 本町駅から250m,11:30 - 15:00L.O. 14:30,■ 定休日なし,カード可 （VISA、Master、JCB、AMEX、Diners） 電子マネー不可 QRコード決済不可,"34.6834063605062,135.50337623848114",06-6243-1388,大阪府大阪市中央区本町3-2-10 ホテルマイステイズ御堂筋本町 1F,96
,イルソーレ,西中島南方駅 279m , イタリアン、ワインバー、イタリアン(パスタ),ワイン＆炭火焼きのお店イタリアンバールイルソーレへようこそ。,"￥3,000～￥3,999","￥3,000～￥3,999",3.39,日曜日,https://tabelog.com/osaka/A2701/A270301/27010592/,予約可,,地下鉄御堂筋線・新大阪駅から徒歩5分地下鉄御堂筋線・西中島南方駅から徒歩5分JR・新大阪駅から徒歩8分阪急京都線・南方駅から徒歩7分 西中島南方駅から279m,18:00 - 22:30L.O. 21:30,■ 営業時間＜ランチ＞現在、ランチ営業は休止しております。■ 定休日日曜日(祝日は営業),カード可 （VISA、Master、JCB、AMEX、Diners） 電子マネー不可 QRコード決済不可,"34.72890923796189,135.4991804777563",06-6885-3362,大阪府大阪市淀川区西中島5-11-10 第３中島ビル　１Ｆ,94
,KIMAGURE ITALI庵 黒猫,新福島駅 311m , フレンチ、バル、イタリアン,季節の風物詩を“猫と一緒に楽しむ”をコンセプトに和テイストな料理を少量多皿で提供致します,"￥6,000～￥7,999","￥6,000～￥7,999",3.39,,https://tabelog.com/osaka/A2701/A270108/27107534/,予約可,お料理のご提供は一斉スタートになります。30分前からの入店が可能です。,徒歩5分 新福島駅から311m,12:00 - 14:30,■ 定休日第１・第３・第５火曜日,カード可 （VISA、Master、JCB、AMEX、Diners） 電子マネー不可 QRコード決済可 （PayPay）,"34.69496833798019,135.48900157742062",06-6940-7725,大阪府大阪市福島区福島1-2-37 ロイヤルハイツ丹後 102,93
,ザ・ループ,堺駅 127m , 洋食、ビュッフェ、イタリアン,,"￥2,000～￥2,999","￥2,000～￥2,999",3.39,-,https://tabelog.com/osaka/A2705/A270501/27069785/,予約可,,■南海本線をご利用の場合・南海なんば駅から特急サザン、空港急行、急行で約9分 　南海本線 「堺」駅 西口に直結南海和歌山市駅から特急サザン、急行で約47分 　南海本線 「堺」駅 西口に直結■南海高野線をご利用の場合・南海堺東駅から南海シャトルバスにて約10分　堺駅（終点）下車（運賃片道 / 大人￥210　子供￥110）■関西空港からお越しの場合・エアポートリムジンバス（堺東駅前・堺駅西口方面行）堺駅前まで約35分（運賃片道 / 大人￥800　子供￥400）旅客ターミナル1階 2番のりばより乗車※関西空港リムジンバスの詳しい時刻表は「南海バス株式会社」のホームページをご覧ください。・南海関西空港駅から特急ラピート（乗車券以外に特急券￥500）で約25分、空港急行で約37分■車をご利用の場合　　　 ・大阪からお越しの場合　　　　　阪神高速15号堺線　住之江出口より約10分　　　 ・和歌山、泉佐野方面からお越しの場合　　　　　阪神高速4号湾岸線　大浜出口より約5分 堺駅から127m,06:30 - 22:00L.O. 21:30,■ 定休日年中無休,カード可 （VISA、Master、JCB、AMEX、Diners） 電子マネー不可 QRコード決済不可,"34.58250305264827,135.4677020266447",072-224-1121,大阪府堺市堺区戎島町4-45-1 1F,78
,てっぱんのスパゲッティ リンクス梅田店,大阪駅 127m , イタリアン(パスタ),,"￥1,000～￥1,999","￥1,000～￥1,999",3.39,-,https://tabelog.com/osaka/A2701/A270101/27132050/,予約不可,,大阪駅から127m,,,カード可 電子マネー可 QRコード決済可,"34.70395553797671,135.49597917750654",06-4256-8333,大阪府大阪市北区大深町1-1 リンクス梅田,78
,アマーク ド パラディ ICC,宮之阪駅 968m , イタリアン、イタリアン(ピザ)、カフェ,,"￥2,000～￥2,999","￥2,000～￥2,999",3.39,-,https://tabelog.com/osaka/A2707/A270702/27066946/,予約可,,枚方市駅からバスで関西外大前にて下車　1分枚方市駅からタクシーで10分（1メーター） 宮之阪駅から968m,11:00 - 23:00,■ 営業時間カフェ11:00～23:00ランチ11:00～16:00（L.O）ディナー17:00～22:00（L.O）■ 定休日無休,カード可 （VISA、Master、JCB、AMEX、Diners） 電子マネー可 QRコード決済不可,"34.82087249502253,135.66253740185837",072-805-3150,大阪府枚方市中宮東之町16-1 関西外大ICCビル 1F,75
,カーサディオーロ,南森町駅 442m , イタリアン、ワインバー、イタリアン(パスタ),【南森町駅7分】ワインと北イタリアを味わう。大切な人との食事や、接待に,"￥4,000～￥4,999","￥4,000～￥4,999",3.39,,https://tabelog.com/osaka/A2701/A270103/27105289/,予約可,,堺筋線・谷町線「南森町」駅1番出口より徒歩7分阪神「梅田」駅M10出口より徒歩11分 南森町駅から442m,11:30 - 14:30L.O. 14:00,■ 定休日月曜日(祝日の場合は営業)、不定休あり,カード可 （VISA、Master、JCB、AMEX、Diners） 電子マネー可 （交通系電子マネー（Suicaなど）、iD、QUICPay） QRコード決済可 （PayPay）,"34.698964937983206,135.5064308774488",06-7710-6583,大阪府大阪市北区西天満5-14-7 和光ビル 1F,73
,クワトロチンクエ 高槻店,高槻駅 254m , イタリアン、バル,,"￥2,000～￥2,999","￥2,000～￥2,999",3.39,月曜日,https://tabelog.com/osaka/A2706/A270604/27049525/,予約可,,JR高槻駅より徒歩3分、阪急高槻市駅より徒歩5分 高槻駅から254m,11:30 - 14:30L.O. 14:10,■ 定休日月曜日※火曜が祝日の場合は営業、翌日休業,カード不可,"34.849977637923224,135.6192364788951",072-681-2425,大阪府高槻市紺屋町6-6 敷島ビル 1F,69
,Le NAPOLI PRESTO 高槻店,高槻市駅 286m , イタリアン、イタリアン(ピザ)、バル,本格窯焼きピッツァの新感覚ファストフード,"￥2,000～￥2,999","￥2,000～￥2,999",3.39,,https://tabelog.com/osaka/A2706/A270604/27136630/,予約可,,阪急高槻市駅から徒歩3分JR高槻駅から徒歩5分 高槻市駅から286m,10:00 - 23:00L.O. 22:45,【Lunch】　10：00～18：00【Dinner】  18：00～23：00※18時以降は、お酒のおつまみを多数ご用意しております。,カード可 （VISA、Master、JCB、AMEX、Diners） 電子マネー可 （交通系電子マネー（Suicaなど）、楽天Edy、nanaco、WAON、iD、QUICPay） QRコード決済可 （PayPay、d払い、楽天ペイ、au PAY）,"34.8497022379237,135.62016387889165",070-2274-9703,大阪府高槻市高槻町16-5 ,64
,パスタコーヴォ,高槻駅 276m , イタリアン(パスタ)、イタリアン、ダイニングバー,,"￥2,000～￥2,999","￥2,000～￥2,999",3.39,-,https://tabelog.com/osaka/A2706/A270604/27078412/,予約可,,ＪＲ京都線 高槻駅 徒歩5分阪急京都線 高槻市駅 徒歩12分 高槻駅から276m,,,カード不可 電子マネー不可 QRコード決済不可,"34.852127037920205,135.6140549789204",072-685-5500,大阪府高槻市芥川町2-9-4 ,61
,トラットリア デッラ ノンナ,肥後橋駅 166m , イタリアン、フレンチ、バル,【肥後橋駅】徒歩3分【淀屋橋駅】徒歩5分★マルケ州の郷土料理を中心とする隠れ家レストラン,"￥5,000～￥5,999","￥5,000～￥5,999",3.39,,https://tabelog.com/osaka/A2701/A270102/27104244/,予約可,,Osaka Metro 四ツ橋線 肥後橋駅6番出口 徒歩3分Osaka Metro 御堂筋線 淀屋橋駅12番出口 徒歩4分 肥後橋駅から166m,18:00 - 22:00L.O. 料理21:00 ドリンク21:30,■ 営業時間[平日限定ビジネスランチ]11:30～15:00(L.O.14:00)[ディナー]18:00～22:00（L.O.21:00）■定休日日曜日、祝日第2土曜日,カード可 （VISA、Master、JCB、AMEX、Diners） 電子マネー可 QRコード決済可 （PayPay、d払い、au PAY）,"34.69022853798603,135.4978817773665",06-4708-3193,大阪府大阪市中央区高麗橋4-8-6 木村ビル 2F,56
,パルゴロ,千鳥橋駅 53m , イタリアン、イタリアン(ピザ),,"￥6,000～￥7,999","￥6,000～￥7,999",3.39,-,https://tabelog.com/osaka/A2701/A270401/27072446/,予約可,予約推奨,阪神なんば線千鳥橋駅北口徒歩30秒 千鳥橋駅から53m,,,カード可 （VISA、Master、JCB、AMEX、Diners） 電子マネー不可,"34.685775337976324,135.45851257734915",06-6464-0651,大阪府大阪市此花区四貫島1-1-39 ,47
,ワインと洋食屋 Haru,新福島駅 77m , 洋食、ワインバー、イタリアン(パスタ),,"￥5,000～￥5,999","￥5,000～￥5,999",3.39,,https://tabelog.com/osaka/A2701/A270108/27113687/,予約可,サービスランチ予約不可。平日13時以降のおまかせランチコース（¥3500）、土日祝はホリデーランチ（¥1890）以上の方は予約可。※全員揃うのが15分以上遅れる場合ご来店前に早目にご連絡下さい（15分過ぎて連絡ない場合キャンセル扱いとなる場合ございます）ディナータイムお食事&ワインの方ご予約お待ちしております。※テイクアウトとランチタイム現金のみ。駐輪駐車不可。,JR東西線　新福島駅3番出口スグJR環状線　福島駅徒歩7分 新福島駅から77m,11:30 - 14:00L.O. 14:00,■ 定休日基本的には水曜ディナーと木曜ランチ&ディナーお休み,カード可 電子マネー可 QRコード決済可,"34.694419737979274,135.48506117741783",06-6136-5275,大阪府大阪市福島区福島3-14-4 ,46
,ウルスブラン,十三駅 458m , カフェ、イタリアン、イタリアン(パスタ),,"￥2,000～￥2,999","￥2,000～￥2,999",3.39,月曜日,https://tabelog.com/osaka/A2701/A270302/27113921/,予約可,,十三駅から徒歩6分 十三駅から458m,11:00 - 22:00L.O. 21:00,■ 定休日不定休あり,カード可 電子マネー可,"34.716474937963845,135.4805343776438",06-6305-0071,大阪府大阪市淀川区新北野1-12-11 ,45
,センバキッチン グリーンハウス ハービスプラザ店,西梅田駅 270m , イタリアン、ステーキ、バル,【梅田ハービスB２F】イタリアン×肉バル♪飲み放題付コース豊富に用意◎宴会・女子会にも,"￥2,000～￥2,999","￥2,000～￥2,999",3.38,,https://tabelog.com/osaka/A2701/A270101/27095373/,予約可,【基本情報の「備考」にも注意事項の記載がございますのでご確認下さい。】※ ご予約当日はお時間通りのご入店をお願い致します。※ 店舗混雑状況により、お席タイプのご要望にお応えできない場合がございます。※ ご連絡がなくご予約時間より15分が経過した場合はお待ち頂いているお客様を優先的にご案内させて頂く場合がございます。,地下鉄四つ橋線 西梅田駅 徒歩5分 西梅田駅から270m,11:00 - 15:30L.O. 14:50,■ 定休日不定休,カード可 （VISA、Master、JCB、AMEX、Diners） 電子マネー可 （WAON、iD、QUICPay） QRコード決済不可,"34.69875753797904,135.49293387745615",06-6346-2345,大阪府大阪市北区梅田2-5-25 ハービスプラザ B2,196
,Farm Cafe mothers 堀江店,西大橋駅 384m , ビュッフェ、カフェ、イタリアン(ピザ),,"￥1,000～￥1,999","￥1,000～￥1,999",3.38,-,https://tabelog.com/osaka/A2701/A270105/27003400/,予約可,,地下鉄四つ橋線 四ツ橋駅 6番出口 徒歩5分 地下鉄長堀鶴見緑地線 西大橋駅 3番出口 徒歩5分 地下鉄千日前線 西長堀駅 6番出口 徒歩5分 阪神なんば線 ドーム前駅 徒歩15分 西大橋駅から384m,09:00 - 16:00,■ 営業時間モーニング　9:00～10:45LOランチ　　　11:00～15:00LO■ 定休日不定休,カード可 （VISA、Master、JCB、AMEX、Diners） 電子マネー不可 QRコード決済可 （PayPay）,"34.67283363799489,135.49099967719562",06-6541-2147,大阪府大阪市西区北堀江2-17-7 ,169
,Pasta de Pasta 阪急三番街店,大阪梅田（阪急）駅 111m , イタリアン(パスタ)、イタリアン(ピザ)、イタリアン,,"￥1,000～￥1,999","￥1,000～￥1,999",3.38,-,https://tabelog.com/osaka/A2701/A270101/27009327/,予約不可,,大阪梅田阪急三番街南館B2 大阪梅田駅（阪急）から111m,11:00 - 22:00,■ 定休日不定休　（阪急三番街に準ずる）,カード可 電子マネー可 QRコード決済可,"34.704746037977145,135.49891387751242",06-6373-4555,大阪府大阪市北区芝田1-1-3 阪急三番街 南館 B2F,149
,コーラルキッチンアットガーデン,高槻市駅 175m , イタリアン、カフェ、スイーツ,【高槻市駅徒歩1分】緑あふれる開放的な癒しの空間で味わう、彩り豊かな創作イタリアン,"￥3,000～￥3,999","￥3,000～￥3,999",3.38,,https://tabelog.com/osaka/A2706/A270604/27121185/,予約可,予約をキャンセルする場合は、以下のキャンセル規定を適用させていただきます。パーティーは7日前まで、コースは4日前まで、お席のみ予約も2日までのキャンセルをお願いします。それ以降のキャンセルについては、キャンセル料が発生いたしますことをご了承ください。※ご予約の時間より10分以上遅れられた場合かつ、ご連絡がつながらなかった場合はキャンセル扱いとさせていただきます。ご了承くださいませ。,阪急京都線 高槻市駅 徒歩3分JR京都線 高槻駅 徒歩3分 高槻市駅から175m,11:00 - 22:00L.O. 料理21:00 ドリンク21:30,■ 定休日年末年始（30日・31日・1日・2日・3日）,カード可 （VISA、Master、JCB、AMEX、Diners） 電子マネー可 QRコード決済可 （PayPay）,"34.8507753379235,135.6217123789014",072-686-0335,大阪府高槻市北園町13-26 ,149
,Italian Dining NATURA,大阪城公園駅 220m , イタリアン、イタリアン(ピザ)、カフェ,大阪ビジネスパークすぐ 天高5ｍの開放的な広々ダイニング♪ お洒落空間で本格イタリアン,"￥3,000～￥3,999","￥3,000～￥3,999",3.38,,https://tabelog.com/osaka/A2701/A270107/27099157/,予約可,,ＪＲ大阪環状線 大阪城公園駅 徒歩1分地下鉄長堀鶴見緑地線 大阪ビジネスパーク駅 徒歩4分ＪＲ東西線 大阪城北詰駅 徒歩8分京阪本線 京橋駅 徒歩10分地下鉄中央線 森ノ宮駅 徒歩12分 大阪城公園駅から220m,11:00 - 22:00,■ 営業時間ランチ　11:00～14:30カフェ　14:30～17:00ディナー　17:00～22:00■定休日年中無休,カード可 （VISA、Master、JCB、AMEX、Diners） 電子マネー可 QRコード決済不可,"34.68908543015684,135.53259771683233",06-6942-3535,大阪府大阪市中央区大阪城3-1 JO-TERRACE OSAKA B TERRACE 103,135
,BLUE YARD,西梅田駅 328m , フレンチ、イタリアン、カフェ,自由に楽しむだけでいい。ここは、音と食の楽園。,"￥5,000～￥5,999","￥5,000～￥5,999",3.38,,https://tabelog.com/osaka/A2701/A270101/27142766/,予約可,,・大阪環状線 大阪駅 徒歩5分・大阪メトロ御堂筋線 梅田駅 徒歩5分・阪急京都線 大阪梅田駅 徒歩10分 西梅田駅から328m,10:00 - 23:00,■DINING11:00～23:00（LO.22:00）LUNCH 11:00～15:00CAFE 15:00～17:00DINNER 17:00～23:00■CAFE STAND10:00～23:00（LO.21:00）■RECORD SHOP10:00～23:00,カード可 （VISA、Master、JCB、AMEX、Diners） 電子マネー可 （交通系電子マネー（Suicaなど）、楽天Edy、nanaco、WAON、iD、QUICPay） QRコード決済可 （PayPay、d払い、楽天ペイ、au PAY）,"34.70174523987918,135.49313245180974",06-4256-5229,大阪府大阪市北区梅田3-2-123 イノゲート大阪 バルチカ03 3F,120
,エッセ　ディ　ピュ,泉佐野駅 925m , イタリアン(ピザ)、イタリアン、イタリアン(パスタ),,"￥4,000～￥4,999","￥4,000～￥4,999",3.38,火曜日,https://tabelog.com/osaka/A2705/A270503/27043837/,予約可,,泉佐野駅から925m,11:00 - 15:00,■ 営業時間※BRUNCHはなくなったので注意,カード可 （VISA、Master、JCB、AMEX、Diners） 電子マネー可 QRコード決済可,"34.41882800242103,135.31306533656263",072-464-1320,大阪府泉佐野市りんくう往来北6番地 いずみさの関空マリーナ内,114
,Quattro Napoli 阪急三番街店,大阪梅田（阪急）駅 45m , イタリアン、イタリアン(パスタ),,"￥2,000～￥2,999","￥2,000～￥2,999",3.38,-,https://tabelog.com/osaka/A2701/A270101/27125688/,予約不可,,大阪梅田駅（阪急）から約67m 大阪梅田駅（阪急）から45m,11:00 - 22:00L.O. 21:30,■ 定休日阪急三番街南館による,カード可 電子マネー可 QRコード決済可 （PayPay、d払い、楽天ペイ、au PAY）,"34.70601663011155,135.49823729091884",06-6136-7331,大阪府大阪市北区芝田1-1-3 阪急三番街南館 B2F,112
,燻製工房 jammy 裏難波店,難波（南海）駅 263m , 居酒屋、イタリアン、ステーキ,【難波駅3分】レゲエが流れる空間で、自家製燻製食材を用いた創作料理を満喫！サク飲み、宴会◎,"￥3,000～￥3,999","￥3,000～￥3,999",3.38,,https://tabelog.com/osaka/A2701/A270202/27084728/,予約可,,南海難波駅、地下鉄難波駅、堺筋線日本橋駅より徒歩約3分 難波駅（南海）から263m,17:00 - 00:00L.O. 23:00,ネット予約満席の際は店舗までご連絡ください,カード可 （VISA、Master、JCB、AMEX、Diners） 電子マネー不可 QRコード決済可 （PayPay）,"34.66524243800381,135.50384787710996",06-6633-5006,大阪府大阪市中央区難波千日前11-3 ,101
,ボーノボーノ,堺市美原区 , イタリアン、イタリアン(ピザ)、スイーツ,富田林・河内長野で採れた野菜をふんだんに使ったイタリアンダイニング◎,"￥3,000～￥3,999","￥3,000～￥3,999",3.38,,https://tabelog.com/osaka/A2708/A270802/27068070/,予約可,何なりとご相談ください。混雑時はお席を譲って頂けるようお声かけをさせて頂く場合がございます。,"●駅からのアクセス南海高野線 北野田駅から車で12分●バス停からのアクセス近鉄バス 北野田線（富田林系統） 木材団地から徒歩2分 大阪狭山市駅から1,679m",11:00 - 14:30,■ 定休日無休（※臨時休業の場合あり）,カード不可 電子マネー可 QRコード決済可 （PayPay）,"34.5140751381214,135.5716392755355",072-320-3820,大阪府堺市美原区木材通4-1-16 ,100
,イタリア食堂ポルコ,肥後橋駅 298m , バル、居酒屋、イタリアン,普段使いのイタリア食堂(^o^)街一番の使い勝手◆15名で貸切可◆,"￥3,000～￥3,999","￥3,000～￥3,999",3.38,,https://tabelog.com/osaka/A2701/A270102/27019073/,予約可,,四つ橋線 肥後橋駅(3番出口)より徒歩4分 肥後橋駅から298m,11:00 - 22:00L.O. 料理21:00,■ 営業時間※15名様より貸切可※日祝のディナーも団体様ご予約・貸切相談可※営業時間外のケータリング・デリバリーも相談可■ 定休日不定休,カード可 （VISA、Master、JCB、AMEX、Diners） 電子マネー不可 QRコード決済不可,"34.69031483798453,135.49333497737058",06-4803-0077,大阪府大阪市西区土佐堀1-4-6 肥後橋新興産ビル1Ｆ,92
,RISTORANTE SPELLO,堺筋本町駅 169m , イタリアン、イタリアン(パスタ)、海鮮,,"￥6,000～￥7,999","￥6,000～￥7,999",3.38,火曜日,https://tabelog.com/osaka/A2701/A270106/27040268/,完全予約制,コースご希望の方は事前にお選び頂いております。,地下鉄堺筋本線・地下鉄中央線　堺筋本町駅6号出口より徒歩2分 堺筋本町駅から169m,11:30 - 13:00,■ 定休日第一、第三水曜日,カード可 （VISA、Master、JCB、AMEX、Diners） 電子マネー不可 QRコード決済不可,"34.68100543799497,135.5075556772666",06-6262-7044,大阪府大阪市中央区久太郎町1-6-20 ノーブルコート堺筋本町,86
,南自由軒,動物園前駅 187m , 洋食、オムライス、イタリアン,,"￥1,000～￥1,999","￥1,000～￥1,999",3.38,火曜日,https://tabelog.com/osaka/A2701/A270206/27086093/,予約可,※ご要望に応じてコース対応可能です。※ご予約のお客様　ご連絡なく30分以上遅れた場合はキャンセルとなりますのでご注意ください。,地下鉄堺筋線 動物園前駅 徒歩3分地下鉄御堂筋線 動物園前駅 徒歩3分 動物園前駅から187m,,,カード不可 電子マネー不可,"34.647468938015464,135.5050144769296",06-6641-0404,大阪府大阪市西成区太子1-11-5 ,80
,シチリア料理トラットリア アリア,肥後橋駅 664m , イタリアン、イタリアン(パスタ)、ワインバー,本日ディナーお席空きあり◎9月17日〜28日はシチリア研修のためお休みいただきます。,"￥8,000～￥9,999","￥8,000～￥9,999",3.38,,https://tabelog.com/osaka/A2701/A270102/27106468/,予約可,※6名様以上のご予約は通常のキャンセル規定とは違い、ご予約が成立した時点よりキャンセル料が発生しますのでご注意ください。※小さなお店ですので大人数のご予約が入るとそれ以降のご予約をお断りすることになりますのでご理解ください。,市営地下鉄四つ橋線　肥後橋駅　⑦番出口より徒歩9分市営地下鉄御堂筋線　本町駅　28番出口より徒歩11分市営地下鉄千日前線　阿波座駅　①番出口より徒歩11分京阪中之島線　中之島駅　⑥番出口より徒歩12分大阪シティバス【75】京町堀一丁目より徒歩1分靭公園より徒歩4分靭テニスセンターより徒歩3分⭕肥後橋駅⑦番出口から車の進行方向と逆向きに歩くと右手に中国東方航空があり、その手前を右へ。道なりに真っ直ぐ5～6分歩くと大きな道路にぶつかります。横断歩道を渡り左へ。なか卯の次にある茶色いマンションを通りすぎてから右へ。すぐ右手にあるコンクリート打ちっぱなしの建物の２階に当店があります。 肥後橋駅から664m,12:00 - 14:30,■ 営業時間基本的にラストオーダーの時間を設けておりませんので、当日の閉店間際にご来店を予定されているお客様は念のためにお電話ください。■ 定休日月曜日（祝日の場合営業、翌平日が休み）⭕定休日でも貸切のご予約でしたらオープン致します,カード可 （VISA、Master、JCB、AMEX、Diners） 電子マネー不可 QRコード決済可 （PayPay）,"34.68630743798669,135.49214387733093",090-2103-4725,大阪府大阪市西区京町堀2-3-4 SUNYAMATO 2F ,80
,イタリアンダイニングペスカ,大阪梅田（阪急）駅 49m , イタリアン,,"￥1,000～￥1,999","￥1,000～￥1,999",3.38,-,https://tabelog.com/osaka/A2701/A270101/27103822/,予約不可,,大阪梅田駅（阪急）から49m 大阪梅田駅（阪急）から49m,11:00 - 23:00L.O. 22:00,■ 定休日施設に準ずる,カード可 （VISA、Master、JCB、AMEX、Diners） 電子マネー可 （交通系電子マネー（Suicaなど）、楽天Edy、QUICPay） QRコード決済可 （PayPay、d払い、楽天ペイ、au PAY）,"34.70604301964183,135.49843560656706",06-6450-8151,大阪府大阪市北区芝田1-1-3 阪急三番街 北館B2F フードコート,78
,WING TIP,百舌鳥駅 899m , イタリアン(ピザ)、イタリアン(パスタ),,"￥1,000～￥1,999","￥1,000～￥1,999",3.38,月曜日,https://tabelog.com/osaka/A2705/A270501/27013203/,予約可,,百舌鳥駅から899m,11:30 - 14:00,■ 定休日月曜日（祝日の場合は翌火曜日）,カード可 （JCB、AMEX、Diners） 電子マネー不可 QRコード決済可,"34.56257783806156,135.48045627608934",072-245-7735,大阪府堺市堺区大仙中町8-2 ,75
